Name,Discount_price,Old_price,Rating_stars
Professional Live Stream With Cell Phone Selfie Holder.,"₦ 18,050",,No rating
Selfie Ring Light With Phone Holder Stand For Live Stream,"₦ 18,050",,No rating
"4pcs Mobile Gaming Thumb Sleeve Sets, Wasp Feelers(2 Pair)","₦ 2,490",,4
"4pcs Mobile Gaming Thumb Sleeve Sets, Wasp Feelers(2 Pair)","₦ 2,490",,4
"4pcs Mobile Gaming Thumb Sleeve Sets, Wasp Feelers(2 Pair)","₦ 2,490",,4.1
"4pcs Mobile Gaming Thumb Sleeve Sets, Wasp Feelers(2 Pair)","₦ 2,490",,4.1
Koocu Small Size Silicone Work Mat Soldering Station Mat Heat Resistant 932°F Anti-Static Magnetic Mat For Electronic Phone Laptop Watch Repair,"₦ 14,000",,4.7
Universal Breathable Thin Mobile Gaming  With Finger Covers,"₦ 4,618",,No rating
Folding 3D Mobile Phone Screen Enlarge Magnifier High-Black,"₦ 7,515",,No rating
Cooler GT31 Semiconductor Magnetic Phone Cooler.,"₦ 17,980",,No rating
2PCS Finger Covers Universal Breathable Ultra-thin Fingertips Sleeves Thumb Gloves For Mobile Game,"₦ 13,745",,1
Travel Portable Digital Accessory Organiser,"₦ 9,800",,No rating
Phonix Rechargeable Phone Cooler Mobile Phone Refrigeration,"₦ 17,850",,No rating
1 Set Headset Case with Hanging Circle Bluetooth-compatible Earbuds Case Black,"₦ 4,158",,No rating
GT31 Mobile Phone Cooling Fan,"₦ 22,500",,No rating
Wall Mounted Phone Charging Organizer/Remote Control Holder,"₦ 3,799",,5
Universal Breathable Thin Mobile Gaming  With Finger Covers,"₦ 4,618",,No rating
Replacement SIM Card Holder Slot Tray-Black For IPhone 8,"₦ 1,670",,No rating
5-in-1 Barbing Kit-Bag Hair&PowderBrushBarbingCapeAftershave,"₦ 5,600",,No rating
2023 Pro 12 Tablet Android  Pad-Blue,"₦ 186,000",,No rating
Mobil 1 5 L- American 5W-30 Extended Performance Ultimate Full Synthetic Engine Oil,"₦ 80,000",,No rating
WiFi Plus Universal 4G/5G LTE Pocket Wifi Mobile Mifi Hotspot Router,"₦ 32,000",,3.5
Lightning USB Cable For IPhone X,"₦ 2,500",,No rating
K9 Wireless Bluetooth Lapel Lavalier Microphones - 2 MINI MICS,"₦ 17,500",,No rating
Phone Bluetooth Shutter Remote For IOS And Android,"₦ 3,200",,No rating
Oraimo Orai*mo Smart Clipper 2 Professional Hair Clippers,"₦ 47,000",,No rating
Pouch Waterproof Case For IPhone Series Upward,"₦ 13,000",,No rating
1 Horse Power Surface Water Pumping Machine +100 % Corper Coil,"₦ 90,000",,No rating
Table Flexible Ringlight,"₦ 20,000",,No rating
FS01 Mobile Phone Rechargeable Fan,"₦ 29,500",,No rating
Original Fast Charger USB Data Cable For IPhone X/8/8,"₦ 4,000",,No rating
Portable Multi Band U Shaped Finger Ring Holder Mobile-White,"₦ 2,789",,No rating
New Age Strong Power Bank,"₦ 17,000",,No rating
"Fast Charger USB Data Cable For IPhone X/8/8Plus/7/7Plus/6s/6sPlus/6/6Plus/SE/5s/5, IPad 4.","₦ 3,500",,No rating
5Pcs Mini Anti-dust Silicone Micro-USB Phone Charger-Black,"₦ 1,670",,No rating
Oraimo Oraiimo Smart-Clipper 2 Gold DiamonBlade Cordless Hair Clipper,"₦ 65,000",,No rating
New Age Strong Power Bank,"₦ 17,000",,No rating
Beldray Airgility Plus Cordless Multi-Surface Vacuum Cleaner,"₦ 180,000",,No rating
Oraimo Smart-Clipper  Plus,"₦ 42,900",,No rating
Sokany Facial & Fabric Garment Steamer,"₦ 23,000",,No rating
Folding 3D Mobile Phone Screen Enlarge Magnifier High-Black,"₦ 7,515",,No rating
6pcs Memory Foam Ear Tips Headphone Sponge Headphone Noise,"₦ 2,400",,No rating
GT31 Mobile Phone Cooling Fan,"₦ 22,500",,No rating
Phone Fish Eye Lens HDcompatible Professional 3 In 1 10X Macro Wide Angle 4K Phone Camera Lens For Taking PhotosBlack,"₦ 5,179",,No rating
Replacement SIM Card Holder Slot Tray-Silver For IPhone X,"₦ 1,670",,5
Universal Breathable Thin Mobile Gaming  With Finger Covers,"₦ 4,618",,No rating
Portable 2-in-1 USB3.0 To TYPE-C OTG Adapter Data-Silver,"₦ 1,670",,No rating
Replacement SIM Card Holder Slot Tray-Black For IPhone 8,"₦ 1,670",,No rating
Bee Single Row Chain Metal Band for i Watch - Compatible with i Watch Series 1-9 and SE-Black,"₦ 15,939",,No rating
5-in-1 Barbing Kit-Bag Hair&PowderBrushBarbingCapeAftershave,"₦ 5,600",,No rating
Mobil 1 5 L- American 5W-30 Extended Performance Ultimate Full Synthetic Engine Oil,"₦ 80,000",,No rating
1 Pair Finger Covers Universal Breathable Ultrathin Game Controller Fingertips Sleeves Thumb Gloves For GamerPink,"₦ 1,599",,No rating
Phone Holder Magnetic Phone Card Holder Sticker Mount Black,"₦ 3,034",,No rating
"MEMO Heatsink Aluminum Chamber,Gaming Cooler For Mobile Phone,cooling USB FAN","₦ 7,061",,No rating
USB Rechargeable Mobile Phone Game Cooler Cooling Fan Radiator,"₦ 7,830",,No rating
Finger Ring Phone Holder 360 Degree Rotatable Strong Adhesiveness Universal Mini Rhinestone Finger Ring Phone Back Sticker Pad Bracket For Outdoor,"₦ 1,025",,No rating
Finger Ring Phone Holder 360 Degree Rotatable Strong Adhesiveness Universal Mini Rhinestone Finger Ring Phone Back Sticker Pad Bracket For Outdoor,₦ 991,,No rating
Y30 Cheap Stereo TWS Wireless 5.0 Bluetooth In-ear Earbuds,"₦ 6,225",,No rating
Y30 Cheap Stereo TWS Wireless 5.0 Bluetooth In-ear Earbuds,"₦ 6,225",,No rating
TF Hybrid Sim Slot Dual SIM Card Adapter Micro SD Extender,"₦ 2,913",,No rating
Nia Superb Sound Wireless Headphone 4 In 1,"₦ 15,570",,No rating
1 Pair Finger Covers Universal Breathable Ultrathin Game Controller Fingertips Sleeves Thumb Gloves For GamerBlue,"₦ 1,529",,No rating
Bluetoothcompatible Remote Control Snapmate Wireless for Phones White,"₦ 5,133",,No rating
For OPPO A5S/A7/12/Realme3 LCD Display Touch Screen Assembly,"₦ 29,490",,No rating
Y30 Bluetooth Wireless Earphone Earbuds For Samsung IPhone Apple Xiaomi Huawei Vivo IOS/Android-Black,"₦ 6,225",,No rating
Mobile Phone Screen Magnifier Pullout Creative Stretch 3d Mobile Phone Magnifying Glass Bracket Amplifier,"₦ 4,397",,No rating
Polishing Cloth For Apple Screen Display,"₦ 8,370",,No rating
1 Horse Power Surface Water Pumping Machine +100 % Corper Coil,"₦ 90,000",,No rating
Lightning USB Cable For IPhone X,"₦ 2,500",,No rating
Qiyi 2345678 Rubik&#39;s Cube Pyramid Maple Leaf Five Magic,"₦ 13,500",,No rating
Smart Wrist Watch Bluetooth GSM Phone For Android Samsung IPhone green,"₦ 9,027",,No rating
Y30 Cheap Stereo TWS Wireless 5.0 Bluetooth In-ear Earbuds,"₦ 6,225",,No rating
Shockproof Armor Case For Infinix Note 40 Pro VIP 12 G96 Hot 40i Play 20i S Zero 30 CAMON 30 4G PRIME CL6 7 Magnetic Cover Ring,"₦ 11,753 - ₦ 17,268",,No rating
1 Pair Finger Covers Universal Breathable Ultrathin Game Controller Fingertips Sleeves Thumb Gloves For GamerGreen,"₦ 1,773",,No rating
Bluetoothcompatible Wireless Remote Control ABS Practical Multifunctional Camera Remote For IPhoneBlack,"₦ 2,694",,No rating
2023 Pro 12 Tablet Android  Pad-Blue,"₦ 186,000",,No rating
E88 Foreign Trade Obstacle Avoidance UAV Folding HD Dual,"₦ 53,300",,No rating
DJI Repair Screwdrivers Tool Set for DJI Mavic 2/2S Phantom 3 4/4 Pro Mavic 2/3 Mini 2/SE/Mini 3 /Mini 3 Pro Spark Avata Drone,"₦ 10,466",,No rating
40W Dual PD USB Multi-port Mobile Phone Fast Charger QC3.0 Fast Charging Head Type-C Adapter European,"₦ 5,346",,No rating
HD USB Webcam Video Recording Built-in Microphone For-Black,"₦ 20,781",,No rating
2PCS Finger Covers Universal Thumb Gloves For Mobile Game,₦ 767,,5
1 Pair Finger Covers Universal Breathable Ultrathin Game Controller Fingertips Sleeves Thumb Gloves For GamerRed,"₦ 1,356",,No rating
2PCS Finger Covers Universal Thumb Gloves For Mobile Game,₦ 767,,4
11Pcs Mobile Phone Opening Pry Tools Kit Screwdriver Set,"₦ 1,926",,No rating
Qiyi 2345678 Rubik&#39;s Cube Pyramid Maple Leaf Five Magic,"₦ 7,000",,4.7
Portable 2-in-1 USB3.0 To TYPE-C OTG Adapter Data-Black,"₦ 1,670",,4.7
TF Hybrid Sim Slot Dual SIM Card Adapter Micro SD Extender,"₦ 1,512",,No rating
2PCS Finger Covers Universal Thumb Gloves For Mobile Game,₦ 767,,5
6pcs Memory Foam Ear Tips Headphone Sponge Headphone Noise,"₦ 2,400",,No rating
H10 4-Finger Dual Cooling Fan Wired Game Controller,"₦ 21,705",,No rating
2PCS Finger Covers Universal Thumb Gloves For Mobile Game,"₦ 1,005",,1
Replacement SIM Card Holder Slot Tray-Silver For IPhone X,"₦ 1,670",,5
Portable 2-in-1 USB3.0 To TYPE-C OTG Adapter Data-Silver,"₦ 1,670",,No rating
2PCS Finger Covers Universal Thumb Gloves For Mobile Game,₦ 767,,1
24 7 FASHION Protective Phone Case Compatible with iPhone 13 Pro,"₦ 2,694",,No rating
2PCS Finger Covers Universal Breathable Ultra-thin Fingertips Sleeves Thumb Gloves For Mobile Game,"₦ 3,599",,3
SHARE THIS PRODUCT   Shipped from abroad (Men's)2PCS Finger Covers Universal Breathable Ultra-thin Fingertips Sleeves Thumb Gloves For Mobile Game,"₦ 9,702",,No rating
Phone Fish Eye Lens HDcompatible Professional 3 In 1 10X Macro Wide Angle 4K Phone Camera Lens For Taking PhotosBlack,"₦ 5,179",,No rating
Bee Single Row Chain Metal Band for i Watch - Compatible with i Watch Series 1-9 and SE-Black,"₦ 15,939",,No rating
1 Pair Finger Covers Universal Breathable Ultrathin Game Controller Fingertips Sleeves Thumb Gloves For GamerPink,"₦ 1,599",,No rating
Finger Ring Phone Holder 360 Degree Rotatable Strong Adhesiveness Universal Mini Rhinestone Finger Ring Phone Back Sticker Pad Bracket For Outdoor,"₦ 1,025",,No rating
Finger Ring Phone Holder 360 Degree Rotatable Strong Adhesiveness Universal Mini Rhinestone Finger Ring Phone Back Sticker Pad Bracket For Outdoor,₦ 991,,No rating
Y30 Cheap Stereo TWS Wireless 5.0 Bluetooth In-ear Earbuds,"₦ 6,225",,No rating
Y30 Cheap Stereo TWS Wireless 5.0 Bluetooth In-ear Earbuds,"₦ 6,225",,No rating
1 Pair Finger Covers Universal Breathable Ultrathin Game Controller Fingertips Sleeves Thumb Gloves For GamerBlue,"₦ 1,529",,No rating
Bluetoothcompatible Remote Control Snapmate Wireless for Phones White,"₦ 5,133",,No rating
Y30 Bluetooth Wireless Earphone Earbuds For Samsung IPhone Apple Xiaomi Huawei Vivo IOS/Android-Black,"₦ 6,225",,No rating
Mobile Phone Screen Magnifier Pullout Creative Stretch 3d Mobile Phone Magnifying Glass Bracket Amplifier,"₦ 4,397",,No rating
Smart Wrist Watch Bluetooth GSM Phone For Android Samsung IPhone green,"₦ 9,027",,No rating
Y30 Cheap Stereo TWS Wireless 5.0 Bluetooth In-ear Earbuds,"₦ 6,225",,No rating
Shockproof Armor Case For Infinix Note 40 Pro VIP 12 G96 Hot 40i Play 20i S Zero 30 CAMON 30 4G PRIME CL6 7 Magnetic Cover Ring,"₦ 11,753 - ₦ 17,268",,No rating
1 Pair Finger Covers Universal Breathable Ultrathin Game Controller Fingertips Sleeves Thumb Gloves For GamerGreen,"₦ 1,773",,No rating
"MEMO Heatsink Aluminum Chamber,Gaming Cooler For Mobile Phone,cooling USB FAN","₦ 7,061",,No rating
TF Hybrid Sim Slot Dual SIM Card Adapter Micro SD Extender,"₦ 2,913",,No rating
Nia Superb Sound Wireless Headphone 4 In 1,"₦ 15,570",,No rating
DJI Repair Screwdrivers Tool Set for DJI Mavic 2/2S Phantom 3 4/4 Pro Mavic 2/3 Mini 2/SE/Mini 3 /Mini 3 Pro Spark Avata Drone,"₦ 10,466",,No rating
40W Dual PD USB Multi-port Mobile Phone Fast Charger QC3.0 Fast Charging Head Type-C Adapter European,"₦ 5,346",,No rating
For OPPO A5S/A7/12/Realme3 LCD Display Touch Screen Assembly,"₦ 29,490",,No rating
USB Rechargeable Mobile Phone Game Cooler Cooling Fan Radiator,"₦ 7,830",,No rating
Natural  Gold Line Purple Agate  Crystal Bracelet iWatch Band - Handmade Jewelry Strap for I Watch Series 1-9,"₦ 31,348",,No rating
Polishing Cloth For Apple Screen Display,"₦ 8,370",,No rating
Screen Enlarger High Clearly Widely Compatible Acrylic 10/12 Inch Simple Operation Video Amplifier Holder For Watching TV-Black,"₦ 14,381",,No rating
2PCS Finger Covers Universal Thumb Gloves For Mobile Game,₦ 767,,No rating
Qiyi 2345678 Rubik&#39;s Cube Pyramid Maple Leaf Five Magic,"₦ 13,500",,No rating
Phone Holder Magnetic Phone Card Holder Sticker Mount Black,"₦ 3,034",,No rating
OLAF Thin Round 10W Wireless Charger Fast Charging For-Black,"₦ 5,193",,No rating
Bluetoothcompatible Wireless Remote Control ABS Practical Multifunctional Camera Remote For IPhoneBlack,"₦ 2,694",,No rating
E88 Foreign Trade Obstacle Avoidance UAV Folding HD Dual,"₦ 53,300",,No rating
Front Lens Screen Back Glass Replacement Repair Kit-Orange,"₦ 58,000",,No rating
Rotating Mobile Phone Stand Desktop Tik Tok Live Stream Photo Telescopic Folding Lazy Metal Tablet Computer Stand,"₦ 5,753 - ₦ 5,996",,No rating
Key Chain Decorative Double Side Glass Ball Solar System Planet Nebula Keychain Pendant Birthday Gift For Mobile Phone,"₦ 1,634",,No rating
HD USB Webcam Video Recording Built-in Microphone For-Black,"₦ 20,781",,No rating
Practical Shockproof Phone Case Antiscratch Close Fit TPU Phone Protective Case For IPhone1313mini13Pro13ProMax,"₦ 1,460",,No rating
Key Chain Charm Nonfading Wide Application Love Heart Cute 3D Strawberry Bell Mini Backpack Pendant For Girl,"₦ 2,920",,No rating
Thickened Mobile Phone Waterproof Bag Waterproof Phone Set Airbag Swimming Shooting Mobile Phone Waterproof Cover,"₦ 5,238",,No rating
Smart Wrist Watch Bluetooth GSM Phone For Android Samsung IPhone green,"₦ 6,797",,No rating
SIM Card Removal Anti-scratch SIM Card Tray Open Pink,"₦ 1,820",,5
Y30 Bluetooth Wireless Earphone Earbuds For Samsung IPhone Apple Xiaomi Huawei Vivo IOS/Android-Black,"₦ 6,225",,No rating
Luminescent Bead Bracelet for iWatch - Compatible with I Watch Series 1-7 and SE-Rose Gold,"₦ 27,998",,No rating
2PCS Finger Covers Universal Breathable Ultra-thin Fingertips Sleeves Thumb Gloves For Mobile Game,"₦ 3,352",,No rating
Qiyi 2345678 Rubik&#39;s Cube Pyramid Maple Leaf Five Magic,"₦ 6,500",,No rating
24 7 FASHION Portable Foldable Mini Desktop Tripod Phone Holder with 3 Sections Extendable Adjustable Phone Clip Length for Smartphone Vlog Recording Selfie Live Stream,"₦ 15,677",,No rating
TF Hybrid Sim Slot Dual SIM Card Adapter Micro SD Extender,"₦ 1,738",,No rating
Western Cowboy Stainless Steel and Metal Denim Bracelet for I Watch - Compatible with Series 9/8/7/6/5/4/3/2/1 SE-Gold,"₦ 18,089",,No rating
Finger Ring Phone Holder 360 Degree Rotatable Strong Adhesiveness Universal Mini Rhinestone Finger Ring Phone Back Sticker Pad Bracket For Outdoor,"₦ 1,321",,No rating
Smart Wrist Watch Bluetooth GSM Phone For Android Samsung IPhone (green),"₦ 7,107",,No rating
SHARE THIS PRODUCT   Shipped From Abroad 5.0 Bluetooth Earphones LED Display Touch Control Headset,"₦ 23,844",,No rating
AV To HDMI Video Signal Converter AV2HDMI Av To Hdmi Av To,"₦ 11,400",,No rating
Mobile Wallet Case Back of Phone Cell Phone Card Holder Blue,"₦ 5,311",,No rating
Shipped From Abroad F9 Portable LED Power Display Wireless Bluetooth 5.0-Black,"₦ 7,785",,No rating
IWatch91 With DiamondEncrusted Metal Watch Band  D Full Of Diamonds Five Beads DesignRose Gold,"₦ 20,254",,No rating
Cross-border New Electric Foot Grinder Beauty Foot,"₦ 16,400",,No rating
Phone Screen Magnifier Foldable High Clearly Image Portable Phone Video Amplifier Stand Bracket For Watching TV-White,"₦ 12,578",,No rating
AV To HDMI Video Signal Converter AV2HDMI Av To Hdmi Av To,"₦ 13,500",,No rating
M06 Full Face Skull Protective Mask For Men And Women,"₦ 33,400",,No rating
Battery Case for Apple Vision Pro Soft Silicone Protective Cover Apple White,"₦ 6,012",,No rating
QCY T1C  5.0  Headphone True Wireless Headphones With Dual,"₦ 28,780",,No rating
Strong Contruction PC 3-layers Close Fit Phone Case Shockproof Phone Protector For IPhone 13 Mini/13/13 Pro/13Pro Max-Light Grey,"₦ 12,578",,No rating
Card Reader 4-in-1 OTG Function Mini USB/Micro USB/8 Pin/Type-C TF/Memory Card Reader For Android-Black,"₦ 13,581",,No rating
For Microsoft Surface Laptop 3 / 4 4 in 1 Bottom Case Rubber,"₦ 20,791",,No rating
Fashion Women Crocodile Faux Leather Clutch Bag Phone-Black,"₦ 2,255",,No rating
1 Pair Charging Cable Protector Durable Anti-tangle-Yellow,"₦ 1,670",,3
Phone Screen Magnifier 5D Visual Effect Foldable PVC 8 Inch 2-4 Times High Clarity Video Amplifier For Watching TV-White,"₦ 12,578",,No rating
Shockproof Armor Case For Infinix Note 40 Pro VIP 12 G96 Hot 40i Play 20i S Zero 30 CAMON 30 4G PRIME CL6 7 Magnetic Cover Ring,"₦ 17,819",,No rating
IWatch9-1 With Diamond-Encrusted Metal Watch Band - D Full Of Diamonds Five Beads Design-Rose Gold,"₦ 20,737",,No rating
2 in 1 360 Rotating LCD Screen Rear Cover Separator,"₦ 118,618",,No rating
Mobile Phone Holder Adjustable 360 Degree Rotatable Universal Bike Bicycle Bracket Mount Stand For Cycling-Yellow,"₦ 12,980",,No rating
(Men's)2PCS Finger Covers Universal Breathable Ultra-thin Fingertips Sleeves Thumb Gloves For Mobile Game,"₦ 25,650",,No rating
Y30 Cheap Stereo TWS Wireless 5.0 Bluetooth Inear Earbuds,"₦ 11,611",,No rating
JC V1SE Mobile Phone Code Reading Programmer For iPhone,"₦ 368,128",,No rating
2PCS Finger Covers Universal Breathable Ultra-thin Fingertips Sleeves Thumb Gloves For Mobile Game,"₦ 33,400",,No rating
1 Pair Finger Covers Universal Breathable Ultrathin Game Controller Fingertips Sleeves Thumb Gloves For GamerRed,"₦ 35,666",,No rating
Shock-proof Phone Case Easy Use TPU All-inclusive Lifted Edge Protective Shell Cover For IPhone 12/12 Pro/12 Mini/12 Pro Max/11/11 Pro/11 Pro Max/X/XS/XR/XR/7/8/7P/8P-Green,"₦ 13,000",,No rating
Phone Strap Pendant Nonfading Decorative Skinfriendly Phone Chain Lanyard Charm Decor For Access CardCreamcoloured,"₦ 1,529",,No rating
Phone Lens Film Cover Antiscratch High Clarity Selfadhesive Smart Phone Rear Lens Ultrathin Tempered Film For IPhone 13 Mini13 Maxfor 13 Pro13 Pro Max,₦ 817,,No rating
For Tecno Pova 6 Neo  Pova 6  Pova 6 Pro LI9  Coque Protective Cover With Ring Iron Sheet Magnetic Sticker Magnetic cooling,"₦ 11,753",,No rating
Phone Radiator Fan Game Cooler System Quick Cooling Fan Black,"₦ 12,170",,No rating
2pcs For Sony WH-CH710N/CH720N/CH700N Headset Earmuffs,"₦ 14,557",,No rating
Dustproof Anti Dust Plug 3.5mm Earphone Jack Sim Card,₦ 700,,No rating
5Pcs Card Pin Universal Anti-lost 12mm Mobile Phone SIM Card Remover Tray Eject Tool For Tablet-Black,"₦ 25,650",,No rating
Shock-proof Phone Case Easy Use TPU All-inclusive Lifted Edge Protective Shell Cover For IPhone 12/12 Pro/12 Mini/12 Pro Max/11/11 Pro/11 Pro Max/X/XS/XR/XR/7/8/7P/8P-Black,"₦ 33,400",,No rating
"360° Rotating Display Turntable For Watch, Shoe, Mannequin, Phones","₦ 34,796",,No rating
USB Powered Soundbar Desktop Speaker Wired Computer Sound,"₦ 19,456",,No rating
Y30 Bluetooth Wireless Earphone Earbuds For Samsung IPhone Apple Xiaomi Huawei Vivo IOS/Android-Black,"₦ 6,225",,No rating
Shock-proof Phone Case Easy Use TPU All-inclusive Lifted Edge Protective Shell Cover For IPhone 12/12 Pro/12 Mini/12 Pro Max/11/11 Pro/11 Pro Max/X/XS/XR/XR/7/8/7P/8P-Pink,"₦ 33,400",,No rating
Battery Case for Apple Vision Pro Soft Silicone Protective Cover Apple Black,"₦ 6,012",,No rating
360° Rotating Display Turntable For Watch Shoe Mannequin Phones Jewelry,"₦ 42,182",,No rating
Phone Case Multifunctional Shock-proof Electroplated Phone Soft TPU Magnetic Fold Bumper Cover With Finger Ring Holder For Samsung Galaxy Flip 3-Grey,"₦ 12,578",,No rating
5Pcs Card Pin Universal Antilost 12mm Mobile Phone SIM Card Remover Tray Eject Tool For TabletBlack,"₦ 1,529",,No rating
DL03 Phone Radiator Quick Cooling High-speed Rotation Universal Semiconductor Mini Phone Cooling Holder For Gaming-Green,"₦ 24,980",,No rating
Finger Ring Holder Cute Bear Shape Foldable PortableBlack,"₦ 2,902",,No rating
1 Pair Finger Cover Sensitive Luminous Breathable Video Games Touch Screen Fingertip Gloves For Gamers-Pink,"₦ 21,710",,No rating
1 Pair X7 Game Trigger Ergonomic Design-Transparent White,"₦ 9,000",,No rating
360° Rotating Display Turntable For Watch Shoe Mannequin Phones Jewelry,"₦ 46,878",,No rating
Phone Finger Lanyard Antifall Scentless Lightweight Phone Ring Rope Key Chain Pendant For Back ShellRed,"₦ 1,529",,No rating
Phone Fish Eye Lens HDcompatible Professional 3 In 1 10X Macro Wide Angle 4K Phone Camera Lens For Taking PhotosSilver,"₦ 3,372",,No rating
New 9.8-inch Portable Rechargeable EVD Player English,"₦ 129,700",,No rating
For AirPods Max Headphone Soft Case Purple,"₦ 28,781",,No rating
Mobile game cooling handle cooler semiconductor phone,"₦ 7,425 - ₦ 10,800",,No rating
Shockabsorbing Phone Protector Card Holder Design TPU Anti Fade Allinclusive Antioxidant Protective Case For IPhone 1212 Pro12 Mini12 Pro Max1111 Pro11 Pro MaxTransparent,"₦ 2,225",,No rating
LCD Touch Screen Digitizer For Samsung Galaxy S7 Edge-Silver,"₦ 280,000",,No rating
Phone Strap Buckle Securefix Phone Strap One-handed Anti-fall Holder ,"₦ 2,048 - ₦ 3,578",,No rating
"MagSafe Magnetic Bracket, Desktop Folding Mobile Phone Bracket, Suspension Screen Car Navigation Holder, Aluminum Alloy Simple Style High Quality Bracket","₦ 20,286 - ₦ 22,218",,No rating
Y16 Smart Watch Touch Control Heart Rate Monitor IP65Blue,"₦ 10,716",,No rating
X13 Phone Cooler Stretchable Quick Cooling AuxiliaryBlack,"₦ 5,221",,No rating
Qkz AK6 Pro 3.5mm Wired Headphones Dynamic Music Earphone,"₦ 16,081",,No rating
2PCS Finger Covers Universal Breathable Ultrathin Fingertips Sleeves Thumb Gloves For Mobile Game,"₦ 32,028",,No rating
360° Rotating Display Turntable For Watch Shoe Mannequin Phones Jewelry,"₦ 43,065",,No rating
2PCS Finger Covers Universal Breathable Ultra-thin Fingertips Sleeves Thumb Gloves For Mobile Game,"₦ 25,650",,No rating
Portable Selfie Button Clicker Wireless Bluetooth Selfie for Android White,"₦ 2,071",,No rating
For OSMO Mobile 3 To 5 6 7 Camera Gimbal Stabilizer,"₦ 47,250",,No rating
Game Gamepad Semiconductor Refrigeration Quick Cooling Universal Phone Cooling Fan Game Grip Handle For Android,"₦ 4,745",,No rating
Multi-use PC Practical Shock-proof Phone Case Full Cover Phone Protector For IPhone 13 Mini/13/13 Pro/13 Pro Max-Red,"₦ 33,400",,No rating
1 Pair Finger Cover Sensitive Luminous Breathable Video Games Touch Screen Fingertip Gloves For Gamers-Black,"₦ 33,400",,No rating
H20 Universal Mini Backlight Touchpad Keyboard Wireless Air-,"₦ 30,000",,No rating
Wireless Charger Stand 3-in-1 Foldable Wireless Charging for Iphone White,"₦ 23,731",,No rating
Key Ring Nonfading Decorative Electroplated AZ 26 Letter Metal Key Chain Charm For Promotional Gifts,"₦ 1,356",,No rating
Phone Screen Amplifier 9D Super Definition Eye-protection Shield Desk Smartphone Screen Magnifier For Watching Movie-Blue,"₦ 20,000",,No rating
Key Ring Nonfading Decorative Electroplated AZ 26 Letter Metal Key Chain Charm For Promotional Gifts,"₦ 1,356",,No rating
Y30 Cheap Stereo TWS Wireless 5.0 Bluetooth Inear Earbuds,"₦ 11,611",,No rating
Y30 Bluetooth Wireless Earphone Earbuds For Samsung IPhone Apple Xiaomi Huawei Vivo IOSAndroidBlack,"₦ 11,611",,No rating
Tablet Dust Plug Universal Silicone Dust Plug Set for Iphone Android Black,"₦ 1,236",,No rating
Natural  Gold Line Purple Agate  Crystal Bracelet iWatch Band - Handmade Jewelry Strap for I Watch Series 1-9,"₦ 29,463",,No rating
TF Hybrid Sim Slot Dual SIM Card Adapter Micro SD Extender,"₦ 3,051",,No rating
2PCS Finger Covers Universal Breathable Ultra-thin Fingertips Sleeves Thumb Gloves For Mobile Game,"₦ 5,468",,No rating
(Women)2PCS Finger Covers Universal Breathable Ultra-thin Fingertips Sleeves Thumb Gloves For Mobile Game,"₦ 33,400",,No rating
2PCS Finger Covers Universal Breathable Ultra-thin Fingertips Sleeves Thumb Gloves For Mobile Game,"₦ 25,650",,No rating
AMOLED Phone LCD Touch Screen Digitizer Replacement-Black,"₦ 65,000",,No rating
Black Shark Magnetic Phone Cooler / Radiator IPhone 12 Up,"₦ 77,422",,No rating
Phone Stand Multi-purpose Stretchable Foldable Universal Wireless Charger Stand For Watching TV-Black,"₦ 12,578",,No rating
2PCS Finger Covers Universal Breathable Ultra-thin Fingertips Sleeves Thumb Gloves For Mobile Game,"₦ 25,650",,No rating
Phone Case High Toughness Anti-fingerprint TPU Shock-absorbing Full Body Coverage Phone Cover For IPhone 12/12 Mini/12 Pro/12 Pro Max-Navy Blue,"₦ 12,578",,No rating
Y30 Bluetooth Wireless Earphone Earbuds For Samsung IPhone Apple Xiaomi Huawei Vivo IOS/Android-Black,"₦ 6,225",,No rating
Multi-use PC Practical Shock-proof Phone Case Full Cover Phone Protector For IPhone 13 Mini/13/13 Pro/13 Pro Max-White,"₦ 13,000",,No rating
Multi-use PC Practical Shock-proof Phone Case Full Cover Phone Protector For IPhone 13 Mini/13/13 Pro/13 Pro Max-White,"₦ 13,000",,No rating
Y30 Bluetooth Wireless Earphone Earbuds For Samsung IPhone Apple Xiaomi Huawei Vivo IOS/Android-Black,"₦ 12,582",,No rating
Faraday Bag for Laptops Techsafe Faraday Bag Fireproof Rfid Signal,"₦ 5,989 - ₦ 24,915",,No rating
Omron  Armband CR24 Universal Sphygmomanometer Accessories,"₦ 73,891",,No rating
Y30 Cheap Stereo TWS Wireless 5.0 Bluetooth Inear Earbuds,"₦ 11,611",,No rating
"360° Rotating Display Turntable For Watch, Shoe, Mannequin, Phones","₦ 68,811",,No rating
Sport Armband Phone Holder  Pouch Bag,"₦ 3,876",,No rating
Phone Lens Film Cover Antiscratch High Clarity Selfadhesive Smart Phone Rear Lens Ultrathin Tempered Film For IPhone 13 Mini13 Maxfor 13 Pro13 Pro Max,₦ 956,,No rating
Phone Protective Case Anti-impact Anti-scratch Lightweight Adorable Folding Rabbit Ear Solid Color Back Shell For IPhone 11 Pro Max/11 Pro/11/XS Max/XR/X/XS/12/12 Pro/12 Pro Max-Black,"₦ 12,578",,No rating
Smart Wrist Watch Bluetooth GSM Phone For Android Samsung IPhone green,"₦ 6,797",,No rating
M6 Smart Watch TWS Earbuds MP3 Player Smart Bracelet,"₦ 108,765",,No rating
2 Colors Protective Leather Holster Case Shoulder Bag With,"₦ 49,950",,No rating
Crossborder Spot MELAO Skincare Body Oil Stretch Mark 125m,"₦ 11,318",,No rating
Multi-use PC Practical Shock-proof Phone Case Full Cover Phone Protector For IPhone 13 Mini/13/13 Pro/13 Pro Max-White,"₦ 13,000",,No rating
