Name,Discount_price,Old_price,Rating_stars
Phone Screen Magnifier Foldable High Clearly Image Portable Phone Video Amplifier Stand Bracket For Watching TV-Black,"₦ 13,581",,No rating
2PCS Finger Covers Universal Breathable Ultra-thin Fingertips Sleeves Thumb Gloves For Mobile Game,"₦ 9,428",,No rating
ABS Height Adjustable Sturdy Phone Stand Foldable Retractable Phone Catcher For Home-Black,"₦ 12,578",,No rating
Phone Protective Case Non-fading Anti-fall Ultra-thin Fashionable 3D Money Man Doll Soft Back Shell For IPhone 11 Pro Max/11 Pro/11/XS Max/XR/X/XS/12/12 Pro/12 Pro Max,"₦ 12,578",,No rating
LCD Display Screen Capacitive High Sensitivity Phone-Black,"₦ 90,000",,No rating
Luminescent Bead Bracelet for iWatch  Compatible with I Watch Series 17 and SERose Gold,"₦ 32,097",,No rating
Stylus Pen Sensitive Anti-fingerprint Lightweight Solid Color Capactive Touch Writing Pen For Samsung Note20/Note20 Ultra 5G-White,"₦ 16,980",,No rating
Phone Holder Strong Bearing Capacity Multi-purpose Adorable Cartoon Spaceman Desk Phone Rack For Watching TV-Golden,"₦ 14,978",,No rating
Front Glass LCD Touch Screen Digitizer Replacement Kit-Black,"₦ 70,000",,No rating
Phone Protective Case Magnetic Anti-Scratch Plastic Phone Protective Covers With Metal Ring For IPhone 13/13 Mini/13 Pro/13 Pro Max-Golden,"₦ 12,578",,No rating
Phone Lanyard Multifunctional Detachable Liquid Silicone Mobilephone Hand Dangled Strap For Mini USB Fan,"₦ 12,578",,No rating
Mobile Phone Holder Universal Foldable Portable Desktop Tablet Cell Phone Stand For Watching TV-Black Gray,"₦ 12,578",,No rating
Stylus Pen Sensitive Anti-fingerprint Lightweight Solid Color Capactive Touch Writing Pen For Samsung Note20/Note20 Ultra 5G-Green,"₦ 16,980",,No rating
Metal Kick Starter Shaft Idle Gear Rebuild Kit For 139QMB,"₦ 44,732",,No rating
Phone Lens Protective Film Anti-scratch Good Hardness Ultra-thin Smart Phone Rear Camera Dust-proof Protector For IPhone 13 Mini/13-Red,"₦ 12,578",,No rating
12PCS / 6 Pairs Replacement Headphone Ear Tips Ear Buds,"₦ 1,900",,No rating
Phone Screen Magnifier Foldable 3D Highly Clear 10/14 Inch Curved Phone Screen Video Amplifier Holder For Watching TV-Black,"₦ 25,650",,No rating
2Pcs Four-finger Linkage Gamepad Triggers Mobile-Golden,"₦ 25,650",,No rating
8 Inch Dimmable Selfie Ring Light USB Powered Desk Lamp LED,"₦ 68,000",,No rating
Mobile Wallet Case Back of Phone Cell Phone Card Holder Green,"₦ 5,428",,No rating
Protective Cover Securefit Kids Tracker Band Anti-lost for Airtag Pink,"₦ 5,377",,No rating
Protective Cover Securefit Kids Tracker Band Anti-lost for Airtag Purple,"₦ 5,377",,No rating
Mini Portable USB 2.0 TF Micro SD Memory Card Reader-Purple,"₦ 12,578",,No rating
Phone Holder Strong Bearing Capacity Multi-purpose Adjustable Ocean Wave Solid Color Phone Tablet Lazy Bracket For Watching TV-Green,"₦ 12,578",,No rating
20Pcs SIM Card Remover Anti-Lost Wide Compatible Round Cellphones SIM Card Pin For Tablet-Sliver White,"₦ 12,578",,No rating
Sf02 Mini USB Charging 9-Speed Brightness Mobile Phone Selfie Artifact LED Ring Light,"₦ 16,180",,No rating
U Disk Mini High Speed IPX7 Waterproof 16GB 32GB 64GB Flash-,"₦ 17,780",,No rating
Laptop Bag Portable Waterproof Cotton 13 Inch Notebook-,"₦ 12,578",,No rating
Phone Camera Tempered Film Anti-scratch High Transmittance Ultra-thin Cell Phone Rear Aluminum Alloy Lens Film Cover For IPhone 13 Series-Pink,"₦ 32,340",,No rating
Phone Lanyard Universal Multi-purpose Washable Handmade Faux Crystal Beads Phone Neck Strap For Keys-White,"₦ 12,578",,No rating
Phone Stand Stretchable Dual Monitor Display Plastic Portable Creative Laptop Extension Bracket For Live Streaming-Black,"₦ 12,578",,No rating
Replacement Metal Phone Single/Dual Slot SIM Card-Golden,"₦ 12,578",,No rating
Mobile Phone Case Shockproof Electroplating Magnetic Ring Holder Phone Back Cover Shell For Samsung S22/S22 Plus/S22 Uitra-Pink,"₦ 12,578",,No rating
Key Chain Decorative Double Side Glass Ball Solar System Planet Nebula Keychain Pendant Birthday Gift For Mobile Phone,"₦ 12,578",,No rating
Waterproof Bag Universal Ultra-thin Cartoon IP68 Floating Air Phone Bag For Swimming-#7,"₦ 12,578",,No rating
Storage Shelf Multi-purpose Strong Adhesiveness Punch-free Wall-mounted Floating Phone Tablet Steady Mount For Home-Yellow,"₦ 12,578",,No rating
LCD Screen And Digitizer Fullembly With Frame For Xiaomi Redmi Note 8 Pro(Single SIM Card)(Silver),"₦ 52,581",,No rating
Replace LCD Touch Screen Digitizer For Sam-sung-Golden,"₦ 65,000",,No rating
Phone Stand Universal Adjustable Folding Mini Portable Desktop Aluminum Alloy Cell Phone Holder For Watching TV-Black,"₦ 12,578",,No rating
Hydrogel Film Anti-scratch Waterproof Ultra-thin Front Rear Phone Clear Hydrogel Protective Cover For Huawei Mate 40/Mata 40 Pro/P40/ P40 Pro/P30/P30 Pro/Mate 30/Mate 30 Pro,"₦ 12,578",,No rating
1 Pair G12 Game Joystick Ergonomic Design Multifunctional Durable Lightweight Smartphone Gamepad For Android-Black,"₦ 12,578",,No rating
SHARE THIS PRODUCT   Shipped From Abroad 5.0 Bluetooth Earphones LED Display Touch Control Headset,"₦ 24,849",,No rating
Mini PCI-E To PCI-E X16 Riser External Graphics Card +-Red,"₦ 15,380",,No rating
Mobile Phone Holder Mini Portable Universal Desktop Stand Cell Phone Lazy Bracket For Watching TV-Black,"₦ 12,578",,No rating
AMOLED LCD Display Touch Screen Digitizer Assembly-,"₦ 72,000",,No rating
Laptop Notebook Sleeve Case Carry Bag Pouch For Macbook-Blue,"₦ 12,578",,No rating
Phone Stand Universal Adjustable Folding Mini Portable Desktop Aluminum Alloy Cell Phone Holder For Watching TV-Yellow,"₦ 12,578",,No rating
SP21 Phone Stand Portable Double Screen Interactive Aluminum Alloy Adjustable Laptop Extension Bracket For Live Streaming-Silver,"₦ 12,578",,No rating
Phone Case Multifunctional Shock-proof Electroplated Phone Soft TPU Magnetic Fold Bumper Cover With Finger Ring Holder For Samsung Galaxy Flip 3-Green,"₦ 12,578",,No rating
2Pcs Replacement Earpads Ear Pad Cushion For Beats Solo 2 /,"₦ 8,400",,No rating
400mah/3.7V Mobile Phone Webcast Live Sound Card External USB Voice Changer,"₦ 38,000",,No rating
Phone Fish Eye Lens HD-compatible Professional 3 In 1 10X Macro Wide Angle 4K Phone Camera Lens For Taking Photos-Black,"₦ 12,578",,No rating
Replacement LCD Touch Screen Digitizer Parts For-Black,"₦ 70,000",,No rating
Phone Back Shell Shock-proof Non-yellowing With Four Hanging Holes Transparent Soft Phone Protective Cover For IPhone 11 Pro Max/11 Pro/11/13 Mini/13/13 Pro/13 Pro Max/12/12 Pro/12 Pro Max-Transparent Black,"₦ 12,578",,No rating
Phone Back Shell Non-fading Anti-impact Ultra-thin Candy Color Round Lens Silicone Phone Protective Cover For IPhone 12/12 Pro/12 Pro Max/13/13 Pro/13 Pro Max-White,"₦ 12,578",,No rating
Phone Holder Strong Bearing Capacity Adjustable Hands-free Desk Smart Phone Bracket For Livestreaming-Black,"₦ 16,980",,No rating
Bluethoot Wireles Phone Camera Shutter Control - Black.,"₦ 16,980",,No rating
Shockproof Anti-wear Phone Case Exquisite Smooth Edge Silicone Phone Protector For IPhone13 Mini/13/13 Pro/13 Pro Max-Black,"₦ 12,578",,No rating
Phone Strap Anti-lost Adjustable Non-fading Long And Short Mobile Phone Hand Strap For Access Card-Blue & White,"₦ 12,578",,No rating
LCD Display Screen Capacitive High Sensitivity Phone-White,"₦ 90,000",,No rating
RT3070L USB Wireless Adapter Stable Signal 150Mbps-Black,"₦ 12,578",,No rating
Phone Lanyard Multifunctional Detachable Liquid Silicone Mobilephone Hand Dangled Strap For Mini USB Fan,"₦ 12,578",,No rating
2PCS Finger Covers Universal Breathable Ultra-thin Fingertips Sleeves Thumb Gloves For Mobile Game,"₦ 25,650",,No rating
Phone Protector Eco-friendly Wear Resistant TPU Shock-absorbing Xmas Themed Phone Case For IPhone 11/11 Pro/11 Pro Max,"₦ 12,578",,No rating
Mobile Phone Holder Foldable Adjustable Universal Desktop Tablet Cell Phone Stand For Live Broadcast-Black,"₦ 12,578",,No rating
Phone Protective Case Soft TPU Scratch-resistant Animal Butterfly Flower Mobile Phone Back Cover For IPhone XR,"₦ 12,578",,No rating
Key Chain Pendant Anti-fall Skin-friendly Smooth Adorable Animal Backpack Pendant Toy For Girls,"₦ 12,578",,No rating
OTG Data Cable Quick Charging Multipurpose Hot SwapBlack,"₦ 24,800",,No rating
Backpack Pendant Toy Multipurpose Decorative Transparent Lucky Mini Kois Fish Tank Key Chain Charm For Men,"₦ 31,296",,No rating
Shockproof Phone Case Easy Use TPU Allinclusive Lifted Edge Protective Shell Cover For IPhone 1212 Pro12 Mini12 Pro Max1111 Pro11 Pro MaxXXSXRXR787P8PPurple,"₦ 12,671",,No rating
Laptop Side Mount Multifunctional Strong Suction Flexible Laptop Dual Monitor Display Phone Magnetic Holder For OfficeSilver,"₦ 31,296",,No rating
USB Wired Mouse Ergonomic Mouse,"₦ 12,268",,No rating
Phone Back Shell Shock-proof Good Hardness With Ring Holder Folding Phone Protective Cover For Samsung Galaxy Z Flip3 5G-Silver,"₦ 12,578",,No rating
Phone Camera Tempered Film Anti-scratch High Transmittance Ultra-thin Cell Phone Rear Aluminum Alloy Lens Film Cover For IPhone 13 Series-Pink,"₦ 12,578",,No rating
Clip-on Lapel Lavalier Microphone 3.5mm Jack Hands-free Mini Wired Condenser Microphone,"₦ 15,981",,No rating
Phone Stand Multifunctional Universal Tight Smart Phone Flexible Bed Lazy Bracket For Watching TV-Blue,"₦ 12,578",,No rating
M6 Smart Watch TWS Earbuds MP3 Player Smart Bracelet,"₦ 64,725",,No rating
Phone Holder Strong Bearing Capacity Multifunctional Fodable Desk Smart Phone Portable Lazy Bracket For Watching TV-Green,"₦ 12,578",,No rating
Phone Camera Tempered Film Anti-scratch High Transmittance Ultra-thin Cell Phone Rear Aluminum Alloy Lens Film Cover For IPhone 13 Series-Red,"₦ 12,578",,No rating
Phone Holder Multifunctional Stretchable Foldable Desk Smart Phone Universal Lazy Bracket For Watching TVGrey,"₦ 34,949",,No rating
Phone Camera Tempered Film High Transmittance Explosion-proof Ultra-thin Smart Phone Rear Single Lens Self-adhesive Film Cover For IPhone 13/13 Mini/13 Pro/13 Pro Max-Silver,"₦ 12,578",,No rating
Phone Protective Case Iphone15 Promax Case Slim Shockproof Scratch Clear,"₦ 5,327 - ₦ 7,962",,No rating
AMOLED Touch Screen Digitizer For Samsung Galaxy S6-Golden,"₦ 122,000",,No rating
Phone Holder Strong Bearing Capacity Multi-purpose Retro Nordic Easter Island Stone Statue Moai Phone Lazy Bracket For Office-Grey,"₦ 22,000",,No rating
Aluminum Alloy Sheet SSD Solid State Disk NVME NGFF M.2.-Red,"₦ 12,578",,No rating
Hanging Holder Punch-free Multifunctional Reversed Charging Hole Wall Mounted Phone Storage Shelf For Home-Yellow,"₦ 12,578",,No rating
Key Ring Non-fading Decorative Electroplated A-Z 26 Letter Metal Key Chain Charm For Promotional Gifts,"₦ 12,578",,No rating
Key Chain Decorative Double Side Glass Ball Solar System Planet Nebula Keychain Pendant Birthday Gift For Mobile Phone,"₦ 12,578",,No rating
Phone Camera Tempered Film Anti-scratch High Transmittance Ultra-thin Cell Phone Rear Aluminum Alloy Lens Film Cover For IPhone 13 Pro Series-Golden,"₦ 12,578",,No rating
Phone Camera Tempered Film High Transmittance Explosion-proof Ultra-thin Smart Phone Rear Single Lens Self-adhesive Film Cover For IPhone 13/13 Mini/13 Pro/13 Pro Max-Silver,"₦ 12,578",,No rating
"Car Suction Cup Glass Holder Triangle Low Angle + 1 4""","₦ 25,650",,No rating
Stain Resistant Mouse Pad Strap Design Faux-Silver & Pink,"₦ 14,978",,No rating
Phone Lens Protective Film Antiscratch Good Hardness Ultrathin Smart Phone Rear Camera Dustproof Protector For IPhone 13 Mini13Golden,"₦ 37,284",,No rating
Replacement Metal Phone Single/Dual Slot SIM Card-Golden,"₦ 12,578",,No rating
LCD Touch Screen Digitizer For Samsung Galaxy S7 EdgeBlack,"₦ 282,818",,No rating
Phone Back Shell Shock-proof Anti-impact Waterproof Crocodile Print Faux Leather Phone Protective Cover For Samsung Galaxy Z Flip3 5G-Blue,"₦ 12,578",,No rating
Mobile Phone Holder Rabbit Ear Magnetic Foldable-Rose Gold,"₦ 12,578",,No rating
Phone Pendant Lovely Cartoon Astronaut Pattern 3 X 3 Mini Cube Educational Stress Relief Backpack Keychain For Students-Light Blue,"₦ 12,578",,No rating
Mobile Phone Holder Mini Universal Portable Cute ChairPink,"₦ 25,092",,No rating
3 In 1 Universal Clip-on Fish Eye Wide Angle Macro Lens-Red,"₦ 10,461",,No rating
Extension Cord Standard Plug And Play 3 Colors USB-Silver,"₦ 12,578",,No rating
"All metal foldable rotating desktop phone stand, mechanical lazy tablet universal stand, learning live streaming stand","₦ 13,770",,No rating
Swimming Bag Anti-lost Sand-prevention IP68 Floating Air Phone Pouch With Hanging Strap For Hiking-Black,"₦ 32,340",,No rating
FY01 Phone Cooler Stretchable Quick Cooling Portable Semiconductor Refrigeration Mobile Phone Cooling Fan For Gaming-Black,"₦ 32,340",,No rating
Mobile Phone Case Shockproof Electroplating Magnetic Ring Holder Phone Back Cover Shell For Samsung S22/S22 Plus/S22 Uitra-Black,"₦ 12,578",,No rating
X12 Phone Cooling Fan Quick Cooling Mute RGB Cool Light Magnetic Semiconductor Widely Compatible Game Cooler Radiator For Smartphone,"₦ 36,775",,No rating
2Pcs Game Controller High Sensitivity 30 Shots/S Fast Free Shooting Key Aim Button Trigger Gamepad For Android Mobile Phone-Black,"₦ 16,180",,No rating
Mobile Phone Case Shockproof Electroplating Magnetic Ring Holder Phone Back Cover Shell For Samsung S22/S22 Plus/S22 Uitra-Green,"₦ 12,578",,No rating
Bluetooth-compatible 5.0 Adapter Mini Clear Sound Quality USB Wireless Dongle Audio Receiver For Car-Black,"₦ 13,378",,No rating
Phone Protective Case Soft TPU Scratch-resistant Animal Butterfly Flower Mobile Phone Back Cover For IPhone XR,"₦ 12,578",,No rating
Women's Smart Watch (Gold),"₦ 131,051",,No rating
Phone Case High Toughness Oleophobic Layer Design TPU Anti-fingerprint Phone Protective Shell For IPhone 13/13 Mini/13 Pro/13 Pro Max-Red,"₦ 32,340",,No rating
OTG Converter Lightweight Good Compatibility ABS Micro-Green,"₦ 32,340",,No rating
Phone Amplifier 10 Inch Multi-function Large Screen Tablet Screen Magnifier For Cell Phone-Black,"₦ 12,578",,No rating
Swimming Bag Anti-lost Sand-prevention IP68 Floating Air Phone Pouch With Hanging Strap For Hiking-Black,"₦ 32,340",,No rating
FY01 Phone Cooler Stretchable Quick Cooling Portable Semiconductor Refrigeration Mobile Phone Cooling Fan For Gaming-Black,"₦ 32,340",,No rating
Mobile Phone Case Shockproof Electroplating Magnetic Ring Holder Phone Back Cover Shell For Samsung S22/S22 Plus/S22 Uitra-Black,"₦ 12,578",,No rating
X12 Phone Cooling Fan Quick Cooling Mute RGB Cool Light Magnetic Semiconductor Widely Compatible Game Cooler Radiator For Smartphone,"₦ 36,775",,No rating
2Pcs Game Controller High Sensitivity 30 Shots/S Fast Free Shooting Key Aim Button Trigger Gamepad For Android Mobile Phone-Black,"₦ 16,180",,No rating
Mobile Phone Case Shockproof Electroplating Magnetic Ring Holder Phone Back Cover Shell For Samsung S22/S22 Plus/S22 Uitra-Green,"₦ 12,578",,No rating
Bluetooth-compatible 5.0 Adapter Mini Clear Sound Quality USB Wireless Dongle Audio Receiver For Car-Black,"₦ 13,378",,No rating
Phone Protective Case Soft TPU Scratch-resistant Animal Butterfly Flower Mobile Phone Back Cover For IPhone XR,"₦ 12,578",,No rating
Women's Smart Watch (Gold),"₦ 131,051",,No rating
Phone Case High Toughness Oleophobic Layer Design TPU Anti-fingerprint Phone Protective Shell For IPhone 13/13 Mini/13 Pro/13 Pro Max-Red,"₦ 32,340",,No rating
OTG Converter Lightweight Good Compatibility ABS Micro-Green,"₦ 32,340",,No rating
Phone Amplifier 10 Inch Multi-function Large Screen Tablet Screen Magnifier For Cell Phone-Black,"₦ 12,578",,No rating
Phone Stand Small Durable Foldable Mobile Phone Metal Finger Ring Holder For Daily Life-Golden,"₦ 32,340",,No rating
Phone Screen Magnifier 5D Visual Effect Foldable PVC 8 Inch 24 Times High Clarity Video Amplifier For Watching TVWhite,"₦ 41,127",,No rating
"Black Replacement Strap For Xiaomi Mi Band 56, M5 M6 Silicone Wristband","₦ 58,080",,No rating
LCD Touch Screen Digitizer For Samsung Galaxy S7 EdgeBlue,"₦ 254,132",,No rating
Phone Screen Magnifier Foldable 3D Highly Clear 1014 Inch Curved Phone Screen Video Amplifier Holder For Watching TVBlack,"₦ 31,058",,No rating
Waterproof Bag Universal Ultra-thin Cartoon IP68 Floating Air Phone Bag For Swimming-#4,"₦ 12,578",,No rating
Phone Case Impact Resistant Super Soft TPU Shock-absorbing Phone Protective Shell For IPhone 13/13 Mini/13 Pro/13 Pro Max-Matcha Green,"₦ 12,578",,No rating
Shockproof Phone Case Close Fit TPU Anti-scratch Smooth Protector Case For Samsung S21-Green,"₦ 12,578",,No rating
Replacement LCD Display Touch Screen DigitizerSilver,"₦ 290,492",,No rating
LCD Touch Screen Digitizer For Sam-sung Galaxy J8 2018-Black,"₦ 49,000",,No rating
Smart Wrist Watch Bluetooth GSM Phone For Android Samsung IPhone (green),"₦ 25,650",,No rating
F3 Phone Screen Amplifier 3D High Clarity Foldable Desk Smartphone Screen Magnifier For Watching Movie-Black,"₦ 18,580",,No rating
SJ6 Legend M20 Sj4000 Sj5000X Wifi SJ7 MC Lens,"₦ 41,850",,No rating
Phone Holder Universal Strong Adhesiveness Folding Desk Smart Phone Mini Lazy Bracket For Video Calling-Black,"₦ 12,578",,No rating
Phone Stand Multifunctional Universal Tight Smart Phone Flexible Bed Lazy Bracket For Watching TV-Pink,"₦ 12,578",,No rating
Phone Holder Portable 360 Degree Rotation Universal Strong Suction Cup Phone Stand For Car,"₦ 12,578",,No rating
1 Pair Game Gamepad Button Control Quick Response Metal Ergonomic Gaming Trigger For IPhone-Black,"₦ 12,578",,No rating
Phone Holder Multifunctional Non-slip Four-sided Pyramid Shape Silicone Phone Tablet Universal Rack For Watching TV-Purple,"₦ 12,578",,No rating
Phone Stand Multifunctional Universal Tight Smart Phone Flexible Bed Lazy Bracket For Watching TV-Light Blue,"₦ 12,578",,No rating
Phone Back Cover Multifunctional Anti-fall Ultra-thin Fashionable Metal Square Buckle Support Phone Case For IPhone 11 Pro Max/11 Pro/11/XS Max/X/XS/12/12 Pro/12 Pro Max-Red,"₦ 12,578",,No rating
Practical Shockproof Phone Case Anti-scratch Close Fit TPU Phone Protective Case For IPhone13/13mini/13Pro/13ProMax,"₦ 12,578",,No rating
Key Ring Non-fading Decorative Electroplated A-Z 26 Letter Metal Key Chain Charm For Promotional Gifts,"₦ 12,578",,No rating
Key Ring Non-fading Decorative Electroplated A-Z 26 Letter Metal Key Chain Charm For Promotional Gifts,"₦ 12,578",,No rating
Key Chain Decorative 12 Constellation Exquisite Universal,"₦ 25,650",,No rating
150Mbps Mini USB Adapter WiFi Wireless 802.11n Lan Card For-,"₦ 12,578",,No rating
Slim Sleek Anti-Slip Aluminum Alloy Computer Gaming-Black,"₦ 16,180",,No rating
Replacement AMOLED Touch Screen Digitizer For Samsung-Black,"₦ 65,000",,No rating
Phone Stand Universal Invisible Folding Mini Portable Aluminum Alloy Cell Phone Holder For Watching TV-Red,"₦ 12,578",,No rating
Finger Ring Phone Holder 360 Degree Rotatable Strong,"₦ 30,043",,No rating
VQ163R Polarized Passive 3D Glasses For 3D TV Real 3D,"₦ 31,296",,No rating
Swimming Bag Antilost Sandprevention IP68 Floating Air Phone Pouch With Hanging Strap For HikingPurple,"₦ 27,922",,No rating
Mobile Phone Wide Angle Lens 37mm 4k Macro Lens Kit For Iphone B,"₦ 27,151",,No rating
Phone Back Cover Antifall Soft TPU Raspberry Koala Eiffel Tower Phone Case Shell For Samsung Galaxy A32,"₦ 31,296",,No rating
Key Chain Pendant Antifall Skinfriendly Smooth Adorable Animal Backpack Pendant Toy For Girls,"₦ 31,296",,No rating
Phone Case High Toughness Oleophobic Layer Design TPU Antifingerprint Phone Protective Shell For IPhone 1313 Mini13 Pro13 Pro MaxAntique White,"₦ 31,296",,No rating
Key Chain Decorative Double Side Glass Ball Solar System Planet Nebula Keychain Pendant Birthday Gift For Mobile Phone,"₦ 35,387",,No rating
Backpack Pendant Toy Multipurpose Decorative Transparent Lucky Mini Kois Fish Tank Key Chain Charm For Men,"₦ 31,296",,No rating
Phone Stand Multifunctional Adjustable Ultra-thin Smart Phone Tablet Desk Mini Lazy Bracket For Watching TV-Silver,"₦ 14,978",,No rating
Curren 8355 Luxury Classic Business Quartz Men Watch 3ATM,"₦ 32,131",,No rating
Z02 Cooling Fan Heat Dissipation Retractable Rechargeable,"₦ 15,697",,No rating
Phone Case High Toughness Oleophobic Layer Design TPURed,"₦ 43,954",,No rating
Strong Contruction PC 3layers Close Fit Phone Case Shockproof Phone Protector For IPhone 13 Mini1313 Pro13Pro MaxLight Grey,"₦ 14,693",,No rating
Factory Wholesale Metal Plug-in Card Bluetooth Speaker Mini,"₦ 12,776",,No rating
Phone Lens 4in1 Universal External Wide Angle Macro Fisheye CPL Cellphone Clip Camera Lens For SmartphoneGolden,"₦ 31,296",,No rating
SP21 Phone Stand Portable Double Screen Interactive Aluminum Alloy Adjustable Laptop Extension Bracket For Live StreamingSilver,"₦ 31,296",,No rating
Phone Screen Magnifier 5D Visual Effect Foldable PVC 8 Inch 2-4 Times High Clarity Video Amplifier For Watching TV-White,"₦ 21,710",,No rating
Monitor Storage Rack Punch-free Adjustable Desktop PC-Black,"₦ 14,381",,No rating
Practical Shockproof Phone Case Anti-scratch Close Fit TPU Phone Protective Case For IPhone13/13mini/13Pro/13ProMax,"₦ 12,578",,No rating
Phone Back Shell Antifall Soft TPU Rose Butterfly Candy Pattern Mobile Phone Cover Case For IPhone13,"₦ 31,296",,No rating
Key Chain Decorative 12 Constellation Exquisite Universal Double Glass Ball Pendant For Phone,"₦ 31,296",,No rating
Phone Gamepad Mute Efficient Heat Dissipation Comfortable Semiconductor Portable Phone Game Joystick For GamersBlack,"₦ 24,165",,No rating
Phone Gamepad Mute Efficient Heat Dissipation Comfortable Semiconductor Portable Phone Game Joystick For GamersBlack,"₦ 33,317",,No rating
2M 4K 1080P Micro USB TYPE C to HDMI-Compatible Cable USB C type-c HDMI TV Digital AV Adapter Cable for Android phone,"₦ 26,070",,No rating
Aluminum Square Mounting Base W 1 Inch ( 25mm ) Bubber Ball,"₦ 29,700",,No rating
Car Phone Holder Universal 360 Degree Rotation MiniBlack,"₦ 31,296",,No rating
Camera Lens Film Shiny Rhinestone Tempered GlassBlack,"₦ 31,296",,No rating
1 Pair Game Joystick Sensitive High Strength Lightweight Bidirectional Auxiliary Phone Gaming Controller Button For IPhoneBlack,"₦ 31,296",,No rating
OTG Data Cable Quick Charging Multipurpose Hot Swap TypeC Male To USB3.0 Female Mini OTG Data Cable For Smart PhoneBlack,"₦ 29,776",,No rating
Sponge Earmuffs For Beats Studio Mixr,"₦ 31,296",,No rating
Double Phone Holder Silicone Suction Cup Phone for Selfies for Iphone Purple,"₦ 11,941",,No rating
Swimming Bag Antilost Sandprevention IP68 Floating Air Phone Pouch With Hanging Strap For HikingWhite,"₦ 31,296",,No rating
KOSPET PROBE Smart Watch 1.3 Inch IPS Full Round Touch,"₦ 94,088",,No rating
OTG Data Cable Quick Charging Multipurpose Hot SwapBlack,"₦ 82,648",,No rating
Mobile Phone Holder Hook Design Wall Mounted Punchfree TV Remote Control Storage Box Organizer For HouseholdWhite,"₦ 31,296",,No rating
87104 Keys Soft Faux Leather Keyboard HandBlack   Gloden,"₦ 31,296",,No rating
D13 Color Screen Touch Wristband HR Blood Pressure Monitor Visible Message Show Smart Watch,"₦ 16,199",,No rating
Swimming Bag Antilost Sandprevention IP68 Floating Air Phone Pouch With Hanging Strap For HikingBlue,"₦ 31,296",,No rating
Universal DrillFree Bathroom Wall Mobile PhoneSilver Gray,"₦ 31,296",,No rating
1 Pair Game Joystick Sensitive High Strength Lightweight Bidirectional Auxiliary Phone Gaming Controller Button For IPhoneBlack,"₦ 31,296",,No rating
OTG Data Cable Quick Charging Multipurpose Hot Swap TypeC Male To USB3.0 Female Mini OTG Data Cable For Smart PhoneBlack,"₦ 29,776",,No rating
Sponge Earmuffs For Beats Studio Mixr,"₦ 31,296",,No rating
Double Phone Holder Silicone Suction Cup Phone for Selfies for Iphone Purple,"₦ 11,941",,No rating
Swimming Bag Antilost Sandprevention IP68 Floating Air Phone Pouch With Hanging Strap For HikingWhite,"₦ 31,296",,No rating
KOSPET PROBE Smart Watch 1.3 Inch IPS Full Round Touch,"₦ 94,088",,No rating
OTG Data Cable Quick Charging Multipurpose Hot SwapBlack,"₦ 82,648",,No rating
Mobile Phone Holder Hook Design Wall Mounted Punchfree TV Remote Control Storage Box Organizer For HouseholdWhite,"₦ 31,296",,No rating
87104 Keys Soft Faux Leather Keyboard HandBlack   Gloden,"₦ 31,296",,No rating
D13 Color Screen Touch Wristband HR Blood Pressure Monitor Visible Message Show Smart Watch,"₦ 16,199",,No rating
Swimming Bag Antilost Sandprevention IP68 Floating Air Phone Pouch With Hanging Strap For HikingBlue,"₦ 31,296",,No rating
Universal DrillFree Bathroom Wall Mobile PhoneSilver Gray,"₦ 31,296",,No rating
HDMI Video Capture Card HDMI To USB Capture Box Computer,"₦ 31,296",,No rating
"Mobile phone lanyard pad, universal mobile phone lanyard label stainless steel mobile phone lanyard patch safety and antifall protection","₦ 31,296",,No rating
AH102 Phone Fan Cooler Dual Fan Quick Cooling ABS Semiconductor Strong Wind Game Radiator For SmartphoneBlack,"₦ 26,336",,No rating
Phone Lens 4in1 Universal External Wide Angle Macro Fisheye CPL Cellphone Clip Camera Lens For SmartphoneGolden,"₦ 24,015",,No rating
Replacement Strap For Xiaomi Mi Band 56 Silicone Wristband,"₦ 31,296",,No rating
Phone Stand Stretchable Dual Monitor Display Plastic Portable Creative Laptop Extension Bracket For Live StreamingDark Gray,"₦ 31,296",,No rating
Memory Card Reader Multifunctional Dual Card Slot ABS MicroTypeCUSBTFOTG SDCard Adapter For Android PhoneWhite,"₦ 42,017",,No rating
Storage Rack Multipurpose Strong Adhesiveness Wall Mounted Phone Storage Stand With Dual Hanger For HomeBlack,"₦ 31,296",,No rating
