Name,Discount_price,Old_price,Rating_stars
Phone Neck Chain Non-fading All-match Adjustable Handmade Braided Phone Strap Pendant For Earphone Sleeve-Light Purple,"₦ 13,000",,No rating
Portable Multi Band U Shaped Finger Ring Holder Grip Stand,"₦ 27,592",,No rating
Tracker Protective Case Airtag Protective Case Bundle for Anti-lost black,"₦ 4,524",,No rating
Tracker Protective Case Airtag Protective Case Bundle for Anti-lost Purple,"₦ 4,524",,No rating
Tracker Protective Case Airtag Protective Case Bundle for Anti-lost Blue,"₦ 4,524",,No rating
Tracker Protective Case Airtag Protective Case Bundle for Anti-lost Green,"₦ 4,524",,No rating
Mobile Phone Case Shockproof Electroplating Magnetic Ring Holder Phone Back Cover Shell For Samsung S22/S22 Plus/S22 Uitra-Purple,"₦ 12,578",,No rating
Waterproof Bag Universal Ultra-thin Cartoon IP68 Floating Air Phone Bag For Swimming-#6,"₦ 12,578",,No rating
Car Phone Holder Creative Cartoon Universal Gravity Car Air Vent Mount GPS Support Stand For Vehicle,"₦ 32,340",,No rating
VER010-X PCI-E Riser Card Professional High Speed-White,"₦ 16,980",,No rating
Y30 Cheap Stereo TWS Wireless 5.0 Bluetooth In-ear Earbuds,"₦ 32,200",,No rating
1 Pair M9 Phone Gamepad Non Delay Convenient Reliable Universal Mobile Phone Gaming Trigger For Android-Yellow,"₦ 12,578",,No rating
Underwater Bag Anti-sinking Dust-proof Large Space-Silver,"₦ 12,578",,No rating
Key Chain Charm Non-fading Wide Application Love Heart Cute 3D Strawberry Bell Mini Backpack Pendant For Girl,"₦ 12,578",,No rating
Electric Heating Underwear Set For Man 22 Area Ski Heating,"₦ 113,760",,No rating
Electric Heating Underwear Set For Women 22 Area Ski,"₦ 108,300",,No rating
"2 PCS  Cover  For JBL Quantum 100 ,Style: Earmuff","₦ 21,650",,No rating
500GB USB3.0 High-speed Portable Hard Disk 2.5 Inch SATA,"₦ 45,090",,No rating
PS5 Host Rear Blu-ray Fan PS5 Optical Drive Version Game,"₦ 18,370",,No rating
DG.Ming All Of Below 6.5 Inch Universal Leather Phone Bag Case For Iphone X 7 8 Plus Phone Wallet Pouch Belt Clip Case Holster 314994 Color1,"₦ 16,728",,No rating
USB 3.0 Type-C Ultra-thin External DVD Burner High-speed,"₦ 24,000",,No rating
VGA To HDMI Conversion Cable Computer To TV HD Conversion,"₦ 11,690",,No rating
500GB USB3.0 High-speed Portable Hard Disk 2.5 Inch SATA,"₦ 45,090",,No rating
Infant And Child Dual-use Toddler Belt Baby,"₦ 9,450",,No rating
Negative Ion Hot And Cold Introduction Instrument Massage,"₦ 42,000",,No rating
2023 New Oblique  Open   Inflatable Pipe  Manufacturers,"₦ 13,500",,No rating
Zigbee Smart Knob Scene Switch For DIY Home Automation,"₦ 13,360",,No rating
Phone Card Holder Different Animals ID Card Credit Pocket,"₦ 7,749",,No rating
AMOLED Touch Screen Digitizer For Samsung Galaxy A50Black,"₦ 80,725",,No rating
LCD Touch Screen Digitizer Parts For Samsung Galaxy J4Black,"₦ 36,952",,No rating
Phone Screen Magnifier Foldable High Clearly Image Portable Phone Video Amplifier Stand Bracket For Watching TVWhite,"₦ 12,774",,No rating
Natural  Grey Agate  Crystal Bracelet iWatch Band - Handmade Jewelry Strap for I Watch Series 1-9,"₦ 29,463",,No rating
540 Degree Rotation Magnetic Fast Charging Type-c-White,"₦ 32,340",,No rating
Western Cowboy Stainless Steel and Metal Denim Bracelet for I Watch - Compatible with Series 9/8/7/6/5/4/3/2/1 SE-Black,"₦ 15,939",,No rating
Boho Agate Brown Leather Metal  Watch Bracelet For I Watch 9-1,"₦ 13,105",,No rating
Boho Agate Leopard Leather Metal Watch Bracelet For I Watch 9-1,"₦ 13,105",,No rating
Boho Agate Beige Leather Metal  Watch Bracelet For I Watch 9-1,"₦ 13,105",,No rating
Dopamine Light Luxury Vintage Charming Pink Green Petal  Watch Band - Compatible with iWatch,"₦ 24,214",,No rating
Selfie Stick Wireless Bluetooth Remote Control Foldable Mini Tripod Mobile Phone with Light Shutter for Ios Android Handheld Gimbal New,"₦ 57,483",,No rating
Twist Rope Chain Bracelet Metal Band for i Watch - Compatible with Series 1-9-Silver-Rose Gold,"₦ 15,939",,No rating
Luminescent Bead Bracelet for iWatch - Compatible with I Watch Series 1-7 and SE-Gold,"₦ 27,998",,No rating
Irregular S-Shaped Vibrant Colors Enamel Petal Elastic Metal Band for iWatch,"₦ 24,214",,No rating
iWatch9-1 with Diamond-Encrusted Metal Watch Band - D Full of Diamonds Five Beads Design-Black,"₦ 20,737",,No rating
Twist Rope Chain Bracelet Metal Band for i Watch - Compatible with  Series 1-9-Silver-Black,"₦ 15,939",,No rating
Irregular S-Shaped Enamel Petal Elastic Metal Band for iWatch in Gray-Blue,"₦ 24,214",,No rating
Natural WhiteAgate Crystal Bracelet iWatch Band - Handmade Jewelry Strap for I Watch Series 1-9,"₦ 29,463",,No rating
Bee Single Row Chain Metal Band for I Watch - Compatible with I Watch Series 1-9 and SE- Gold,"₦ 15,939",,No rating
Boho Agate Grey Leopard Leather Metal Watch Bracelet For I Watch 9-1,"₦ 13,105",,No rating
P11 Phone Radiator Quick Cooling Low Noise Universal Suction Cup Physical Phone Cooling Fan For Gaming-Black,"₦ 32,340",,No rating
VIBRANT GLAMOUR  VG-YB003,"₦ 32,340",,No rating
Western Cowboy Stainless Steel and Metal Denim Bracelet for I Watch - Compatible with Series 9/8/7/6/5/4/3/2/1 SE-Gold,"₦ 15,939",,No rating
Selens Magnetic Mount Stand 1 4 20 Threaded For Hero 8 7 6,"₦ 29,700",,No rating
Tablet Stand Multi-purpose Adjustable Foldable Universal Metal Desk Tablet Bracket For Watching TV-Black,"₦ 12,578",,No rating
Y16 Smart Watch Touch Control Heart Rate Monitor IP65-Blue,"₦ 28,612",,No rating
Swimming Pouch Easy Operation Anti-lost Transparent IP68-#1,"₦ 10,800",,No rating
Phone Protective Case Anti-fall Soft Anti-stress INS Cute 3D Peach Decompress Girls Phone Case For IPhone 13/13 Pro/13 Pro Max/12/12 Pro/12 Pro Max/11/11 Pro/11 Pro Max,"₦ 12,578",,No rating
Phone Stand Universal Invisible Folding Mini Portable Aluminum Alloy Cell Phone Holder For Watching TV-Black,"₦ 12,578",,No rating
Phone Stand Universal Adjustable Folding Mini Portable Desktop Aluminum Alloy Cell Phone Holder For Watching TV-Purple,"₦ 12,578",,No rating
Phone Converter High-speed Multifunctional Hot Swap USB3.1 Male To Type-C Female Mini Converter For Smartphone-Silver,"₦ 12,578",,No rating
Q18 Smart Watch Strong Bluetooth SmartWatch,"₦ 17,424",,No rating
Phone Camera Tempered Film High Transmittance Explosion-proof Ultra-thin Smart Phone Rear Single Lens Self-adhesive Film Cover For IPhone 13/13 Mini/13 Pro/13 Pro Max-Black,"₦ 12,578",,No rating
Phone Stand Rebound Anti-skid 2 In 1 Watch Charger Phone Bracket For IPhone Smartwatch-Pink,"₦ 12,578",,No rating
Phone Stand Multifunctional Universal Tight Smart Phone Flexible Bed Lazy Bracket For Watching TV-Black,"₦ 12,578",,No rating
U-shaped Universal Cell Phone Grip Stand Back-Rose Golden,"₦ 12,578",,No rating
Replacement Front Glass Screen Repair Kit For Samsung A51-,"₦ 27,981",,No rating
AMOLED Touch Screen Digitizer Parts For Samsung Galaxy-Black,"₦ 117,000",,No rating
Phone Case Multifunctional Shock-proof Electroplated Phone Soft TPU Magnetic Fold Bumper Cover With Finger Ring Holder For Samsung Galaxy Flip 3-Purple,"₦ 12,578",,No rating
Phone Camera Tempered Film High Transmittance Explosion-proof Ultra-thin Smart Phone Rear Single Lens Self-adhesive Film Cover For IPhone 13/13 Mini/13 Pro/13 Pro Max-Silver,"₦ 12,578",,No rating
"Monitor Mount Holder With Cold Shoe Interface, Gimbal","₦ 31,050",,No rating
X13 Powerful Radiator Fast Rotation Retractable Gaming 7-blade Phone Cooling Holder For Watching TV-Black,"₦ 12,578",,No rating
Phone Back Shell Shock-proof Anti-impact Soft Liquid Silicone Phone Protective Cover For IPhone 7 Plus/8 Plus/X/XS/XR/XS Max/11/11 Pro/11 Pro Max/12/12 Pro/12 Pro Max/13/13 Pro/13 Pro Max-Brown,"₦ 12,578",,No rating
Car Mobile Phone Holder Universal 360 Degrees Rotation Suction Mount Cellphone Dashboard Bracket Stand For Desktop-Black,"₦ 12,578",,No rating
Mobile Phone Video Screen  Amplifier Expander Holder,"₦ 13,000",,No rating
LCD Touch Screen Professional High Sensitivity AMOLED LCD Display Digitizer Replace Assembly For Samsung Galaxy A01 Core A013 A013F,"₦ 69,000",,No rating
87/104 Keys Soft Faux Leather Keyboard Hand-Black Silver,"₦ 18,782",,No rating
Phone Case Anti-fingerprint Smooth Surface TPU Phone Back Case With Card Holder For IPhone 13/13 Mini/13 Pro/13 Pro Max,"₦ 12,578",,No rating
Phone Protective Case Non-fading Shock-proof Glittery Smart Phone Ultra-thin Back Shell For IPhone 13 Mini/13/13 Pro/13 Pro Max-Transparent,"₦ 12,578",,No rating
SIM Card Tray + SIM Card Tray + Micro SD Card Tray For Nokia 3.1 Plus (Black),"₦ 25,650",,No rating
Key Chain Decorative Double Side Glass Ball Solar System Planet Nebula Keychain Pendant Birthday Gift For Mobile Phone,"₦ 12,578",,No rating
Phone Back Shell Anti-fall Non-yellowing Transparent Soft TPU Phone Protective Cover With Four Air Bags For IPhone 13 Mini/13/13 Pro/13 Pro Max-Transparent,"₦ 12,578",,No rating
Anti-impact Converter Quick Transmission Hot Swap USB-Golden,"₦ 12,578",,No rating
Bag Pendant Decorative Non-fading Electroplated Simulation 3D Scooter Key Ring Buckle For Advertising Gift-Silver,"₦ 12,578",,No rating
2Pcs Game Controller ABS Key Dragon Shape Sensitive Video Game Phone Auxiliary Gaming Trigger For Android-Rose Gold,"₦ 12,578",,No rating
LCD Display Screen Capacitive High Sensitivity Phone-Blue,"₦ 90,000",,No rating
Shock-proof Phone Case Easy Use TPU All-inclusive Lifted Edge Protective Shell Cover For IPhone 12/12 Pro/12 Mini/12 Pro Max/11/11 Pro/11 Pro Max/X/XS/XR/XR/7/8/7P/8P-Clear,"₦ 33,400",,No rating
Hydrogel Film Anti-fingerprint High Clarity Ultra-thin Front Rear Phone Full Coverage Hydrogel Protective Film For Vivo X50/X50 Pro/X50 Pro+/X60/X60 Pro/X60 Pro+,"₦ 12,578",,No rating
M10/M11 Trigger Gamepad Long Service Life Sensitive Easy To Hold 6 Finger Trigger Phone Controller Gamepad,"₦ 21,000",,No rating
SP21 Phone Stand Portable Double Screen Interactive Aluminum Alloy Adjustable Laptop Extension Bracket For Live Streaming-Pink,"₦ 12,578",,No rating
8'' Screen Magnifier 3D Smartphone Magnifying Glass Screen Enlarger Protector,"₦ 15,000",,No rating
Electric Oscillating Tool Lithiumion Cordless,"₦ 103,608",,No rating
"Smart Protective Cover For Smart Watch Soft Silicone Protective Case For Huami Amazfit Verge 3 Colorful Sporty Style Avoid Scratches, Bumps, Grease And Fingerprints","₦ 13,000",,No rating
Key Chain Decorative Double Side Glass Ball Solar System Planet Nebula Keychain Pendant Birthday Gift For Mobile Phone,"₦ 12,578",,No rating
Phone Protector Eco-friendly Wear Resistant TPU Shock-absorbing Xmas Themed Phone Case For IPhone 11/11 Pro/11 Pro Max,"₦ 12,578",,No rating
LCD Display Touch Screen Digitizer Assembly Parts For-Red,"₦ 66,000",,No rating
300Mbps Wireless Repeater Network Router WiFi Signal-,"₦ 27,000",,No rating
Phone Camera Tempered Film Anti-scratch High Transmittance Ultra-thin Cell Phone Rear Aluminum Alloy Lens Film Cover For IPhone 13 Pro Series-Black,"₦ 12,578",,No rating
Phone Tempered Film Anti-fingerprint Clear Anti-explosion Smart Phone Screen Hard Protective Cover For IPhone 7/8/SE/7 Plus/8 Plus/X/XS/XR/XS Max/ 11//11 Pro/11 Pro Max/12 Mini/12/12 Pro/12 Pro Max/13 Mini/13/13 Pro/13 Pro Max,"₦ 12,578",,No rating
Phone Stand Stretchable Dual Monitor Display Plastic Portable Creative Laptop Extension Bracket For Live Streaming-Light Grey,"₦ 25,650",,No rating
Phone Stand Universal Invisible Folding Mini Portable Aluminum Alloy Cell Phone Holder For Watching TV-Grey,"₦ 12,578",,No rating
Phone Stand Multifunctional 360 Degree Rotation Lightweight Universal Neckband Flexible Phone Lazy Bracket For Watching TV-Yellow,"₦ 13,581",,No rating
手机指环支架 手机支夹扣指环扣金属环360度支架旋转女拉环戒指 Red,"₦ 10,000",,No rating
Phone Cooler Magnetic Semiconductor Refrigeration Universal Quick Cooling Mobile Phone Tablet Cooling Fan For Gaming-White,"₦ 29,000",,No rating
Phone Protective Case Soft TPU Scratch-resistant Animal Butterfly Flower Mobile Phone Back Cover For IPhone XR,"₦ 12,578",,No rating
2PCS Finger Covers Universal Breathable Ultra-thin Fingertips Sleeves Thumb Gloves For Mobile Game,"₦ 25,650",,No rating
Chinese Character Dislike Pretending Phone Case Cover For-2#,"₦ 12,578",,No rating
Tablet Stand Portable Foldable Adjustable Aluminum Alloy Tablet Lazy Holder For Home-Silver,"₦ 14,381",,No rating
Laptop Magnetic Holder Dual Screen Adjustable Aluminum-Grey,"₦ 15,981",,No rating
AMOLED LCD Display Screen Replacement With Touch Assembly-,"₦ 129,000",,No rating
Audio Converter Multifunctional Quick Transmission Hot Swap 2 In 1 Type-C Phone Plug Play Audio Adapter Cable For Charging-Bright Red,"₦ 12,578",,No rating
Mobile Phone Lens 2-in-1 4K HD-compatible External Wide Angle Macro Cellphone Clip Camera Lens For Smartphone-Black,"₦ 19,380",,No rating
Phone Holder Strong Bearing Capacity Multifunctional Universal Desk Smart Phone Mini Lazy Bracket For Watching TV-Green,"₦ 12,578",,No rating
Strong Contruction PC 3-layers Close Fit Phone Case Shockproof Phone Protector For IPhone 13 Mini/13/13 Pro/13Pro Max-Atrovirens,"₦ 12,578",,No rating
Phone Stand Multifunctional Adjustable Ultra-thin Cell Phone Desk Portable Stand Holder For Watching TV-Black,"₦ 13,000",,No rating
Phone Holder Strong Bearing Capacity Stretchable Desk Smart Phone Lazy Bracket With Mirror For Watching TV-Rose Red #,"₦ 12,578",,No rating
Selfie Screen Bracket Flip Up Mirror For 8 7 6 5 Vlog,"₦ 27,000",,No rating
Dust Cover Wear-resistant Anti-scratch Waterproof-Silver,"₦ 16,980",,No rating
LCD Touch Screen Capacitive Anti-scratch AMOLED LCD-Black,"₦ 86,000",,No rating
Storage Shelf Multi-purpose Strong Adhesiveness Punch-free Wall-mounted Floating Phone Tablet Steady Mount For Home-Dark Blue,"₦ 12,578",,No rating
Camera Protector Super Thin Anti-spy 2 Colors Camera-White,"₦ 12,578",,No rating
2Pcs Replacement Earpads Ear Pad Cushion For Beats Solo 2 /,"₦ 8,400",,No rating
Key Ring Non-fading Decorative Electroplated A-Z 26 Letter Metal Key Chain Charm For Promotional Gifts,"₦ 12,578",,No rating
1TB USB3.0 Highspeed Portable Hard Disk 2.5 Inch SATA,"₦ 53,423",,No rating
Phone Case High Toughness Anti-fingerprint TPU Shock-absorbing Full Body Coverage Phone Cover For IPhone 12/12 Mini/12 Pro/12 Pro Max-Sliver White,"₦ 12,578",,No rating
Phone Back Shell Shock-proof Anti-impact Soft Liquid Silicone Phone Protective Cover For IPhone 7 Plus/8 Plus/X/XS/XR/XS Max/11/11 Pro/11 Pro Max/12/12 Pro/12 Pro Max/13/13 Pro/13 Pro Max-Purple,"₦ 12,578",,No rating
Phone Holder Strong Bearing Capacity Stretchable Desk Smart Phone Lazy Bracket With Mirror For Watching TV-Yellow,"₦ 12,578",,No rating
Phone Lens 4-in-1 Universal External Wide Angle Macro Fisheye CPL Cellphone Clip Camera Lens For Smartphone-Silver,"₦ 14,000",,No rating
Replacement LCD Display Touch Screen Digitizer-Golden,"₦ 65,000",,No rating
LCD Touch Screen Digitizer For Samsung Galaxy S7 Edge-Golden,"₦ 280,000",,No rating
Designer 14-inch Apple Notebook Conference Bag Applies To Macbook Pro,"₦ 25,650",,No rating
Shockproof Phone Case Easy Use TPU Allinclusive Lifted Edge Protective Shell Cover For IPhone 1212 Pro12 Mini12 Pro Max1111 Pro11 Pro MaxXXSXRXR787P8PPink,"₦ 12,671",,No rating
X12 Phone Cooling Fan Quick Cooling Mute RGB Cool Light Magnetic Semiconductor Widely Compatible Game Cooler Radiator For Smartphone,"₦ 32,000",,No rating
Replacement LCD Display Touch Screen Digitizer-Black,"₦ 65,000",,No rating
Phone Lens Protective Film Anti-scratch Good Hardness Ultra-thin Smart Phone Rear Camera Dust-proof Protector For IPhone 13 Mini/13-Black,"₦ 12,578",,No rating
Phone Bracket Universal Multi-purpose Ultra-thin Desk Phone Tablet Rack For Teleconference-Silver,"₦ 18,580",,No rating
1412 inch Mobile Phone Screen Magnifier Pullout Creative Stretch 3d Mobile Phone Magnifying Glass Bracket Amplifier,"₦ 35,358 - ₦ 39,376",,No rating
1TB USB3.0 Highspeed Portable Hard Disk 2.5 Inch SATA,"₦ 53,423",,No rating
Shock-proof Phone Case Dust-proof TPU Full Protection Anti-slip Protective Shell For IPhone 13 Mini/13/13 Pro/13 Pro Max-Black,"₦ 12,578",,No rating
Phone Strap Pendant Non-fading Decorative Skin-friendly Phone Chain Lanyard Charm Decor For Access Card-Cream-coloured,"₦ 12,578",,No rating
Shock-proof Hard Bag Handbag For FPV Google V2 Portable,"₦ 40,500",,No rating
Phone Holder Pyramid Shape Non-Slip Silicone Adjustable Viewing Angles Smartphone Desk Stand For Home-Yellow,"₦ 12,578",,No rating
Laptop Bag Portable Waterproof Cotton 13 Inch Notebook-,"₦ 12,578",,No rating
Multi-function UV Box For Face Cover Phone Charge Phone,"₦ 72,000",,No rating
Phone Back Shell Shock-proof Anti-impact Soft Liquid Silicone Phone Protective Cover For IPhone 7 Plus/8 Plus/X/XS/XR/XS Max/11/11 Pro/11 Pro Max/12/12 Pro/12 Pro Max/13/13 Pro/13 Pro Max-Cyan,"₦ 12,578",,No rating
Phone Microscope Lens Multifunctional Wide Angle With LED Light 30X External Phone Microscope For Research-Black,"₦ 12,578",,No rating
Phone Protective Case Soft TPU Scratch-resistant Animal Butterfly Flower Mobile Phone Back Cover For IPhone XR,"₦ 12,578",,No rating
Z02 Cooling Fan Heat Dissipation Retractable Rechargeable-,"₦ 10,200",,No rating
Shock-proof Phone Case Easy Use TPU All-inclusive Lifted Edge Protective Shell Cover For IPhone 12/12 Pro/12 Mini/12 Pro Max/11/11 Pro/11 Pro Max/X/XS/XR/XR/7/8/7P/8P-Green,"₦ 33,400",,No rating
LCD Touch Screen Digitizer For Samsung Galaxy J2 Pro-Golden,"₦ 42,000",,No rating
Key Ring Non-fading Decorative Electroplated A-Z 26 Letter Metal Key Chain Charm For Promotional Gifts,"₦ 12,578",,No rating
2PCS Finger Covers Universal Breathable Ultra-thin Fingertips Sleeves Thumb Gloves For Mobile Game,"₦ 25,650",,No rating
Phone Camera Tempered Film Anti-scratch High Transmittance Ultra-thin Cell Phone Rear Aluminum Alloy Lens Film Cover For IPhone 13 Series-Midnight Black,"₦ 12,578",,No rating
Durable AMOLED Phone Screen Digitizer Replacement-Golden,"₦ 112,000",,No rating
Waterproof Bag Universal Ultra-thin Lightweight IP68 Resilient Air Phone Pouch Case For Swimming-Clear,"₦ 12,578",,No rating
Ring Washable Detachable Silicone Portable Key-Light Blue,"₦ 12,578",,No rating
Hanging Holder Punch-free Multifunctional Reversed Charging Hole Wall Mounted Phone Storage Shelf For Home-White,"₦ 12,578",,No rating
Phone Case High Toughness Oleophobic Layer Design TPU Anti-fingerprint Phone Protective Shell For IPhone 13/13 Mini/13 Pro/13 Pro Max-Matcha Green,"₦ 12,578",,No rating
Smart Tracker Anti Lost Bluetooth Smart Finder For Kids Key,"₦ 17,000",,No rating
Touch Screen Digitizer Sensor Glass Panel For Samsung-,"₦ 65,000",,No rating
Phone Stand Rebound Anti-skid 2 In 1 Watch Charger Phone Bracket For IPhone Smartwatch-Black,"₦ 12,578",,No rating
Phone Holder Adjustable Shock-resistant Foldable Smartphone Tablet Desk Stand For Video Calling-White,"₦ 12,578",,No rating
Phone Back Shell Anti-fall Non-yellowing Soft Liquid Silicone Phone Protective Cover For IPhone 7/8/SE/7 Plus/8Plus/X/XS/XR/XS Max/11/11Pro/11 Pro Max/12 Mini/12/12 Pro/12 Pro Max/13 Mini/13/13 Pro/13 Pro Max-Red,"₦ 12,578",,No rating
Phone Stand Rebound Anti-skid 2 In 1 Watch Charger Phone Bracket For IPhone Smartwatch-Blue,"₦ 12,578",,No rating
Mobile Phone Holder Multifunctional Wall-mounted Phone Remote Control Storage Box Organizer For Living Room-White,"₦ 12,578",,No rating
Nano Stickers Multifunctional Storage Stickers Stickers Nano,"₦ 10,000",,No rating
5 In 1 USB-C Converter Adapter USB 3.0 HMDI/PD/TF Card-,"₦ 56,700",,No rating
ONE X2 Premium Lens Guards 10m Waterproof Complete,"₦ 64,800",,No rating
Practical Shockproof Phone Case Anti-scratch Close Fit TPU Phone Protective Case For IPhone13/13mini/13Pro/13ProMax,"₦ 12,578",,No rating
Storage Shelf Multifunctional Strong Bearing Capacity Punch-free Wall-mounted Floating Steady Phone Charging Mount For Bedroom-Dark Blue,"₦ 12,578",,No rating
Smart Tracker Anti Lost Bluetooth Smart Finder For Kids Key,"₦ 17,000",,No rating
Touch Screen Digitizer Sensor Glass Panel For Samsung-,"₦ 65,000",,No rating
Phone Stand Rebound Anti-skid 2 In 1 Watch Charger Phone Bracket For IPhone Smartwatch-Black,"₦ 12,578",,No rating
Phone Holder Adjustable Shock-resistant Foldable Smartphone Tablet Desk Stand For Video Calling-White,"₦ 12,578",,No rating
Phone Back Shell Anti-fall Non-yellowing Soft Liquid Silicone Phone Protective Cover For IPhone 7/8/SE/7 Plus/8Plus/X/XS/XR/XS Max/11/11Pro/11 Pro Max/12 Mini/12/12 Pro/12 Pro Max/13 Mini/13/13 Pro/13 Pro Max-Red,"₦ 12,578",,No rating
Phone Stand Rebound Anti-skid 2 In 1 Watch Charger Phone Bracket For IPhone Smartwatch-Blue,"₦ 12,578",,No rating
Mobile Phone Holder Multifunctional Wall-mounted Phone Remote Control Storage Box Organizer For Living Room-White,"₦ 12,578",,No rating
Nano Stickers Multifunctional Storage Stickers Stickers Nano,"₦ 10,000",,No rating
5 In 1 USB-C Converter Adapter USB 3.0 HMDI/PD/TF Card-,"₦ 56,700",,No rating
ONE X2 Premium Lens Guards 10m Waterproof Complete,"₦ 64,800",,No rating
Practical Shockproof Phone Case Anti-scratch Close Fit TPU Phone Protective Case For IPhone13/13mini/13Pro/13ProMax,"₦ 12,578",,No rating
Storage Shelf Multifunctional Strong Bearing Capacity Punch-free Wall-mounted Floating Steady Phone Charging Mount For Bedroom-Dark Blue,"₦ 12,578",,No rating
Phone Camera Tempered Film High Transmittance Explosion-proof Ultra-thin Smart Phone Rear Single Lens Self-adhesive Film Cover For IPhone 13/13 Mini/13 Pro/13 Pro Max-Silver,"₦ 25,650",,No rating
Phone Stand Stretchable Dual Monitor Display Plastic Portable Creative Laptop Extension Bracket For Live Streaming-Navy Blue,"₦ 12,578",,No rating
Hanging Holder Punch-free Multifunctional Reversed Charging Hole Wall Mounted Phone Storage Shelf For Home-Black,"₦ 12,578",,No rating
Mobile Phone Bracket Stable Load-bearing Bluetooth-compatible 4.0 Mobile Phone Tripod Black,"₦ 25,650",,No rating
VER009S PULS PCI-E Riser Board Professional High Speed-Black,"₦ 15,981",,No rating
Mobile Phone Holder Multifunctional Wall-mounted Phone Remote Control Storage Box Organizer For Living Room-Yellow,"₦ 12,578",,No rating
Key Ring Non-fading Decorative Electroplated A-Z 26 Letter Metal Key Chain Charm For Promotional Gifts,"₦ 12,578",,No rating
1 4 Single Layer Tripod Mount Screw To Studio Flash Hot,"₦ 25,650",,No rating
2Pcs Laptop Stand Collapsible Heat Dissipation ABS-Black,"₦ 25,650",,No rating
Hydrogel Film Anti-fingerprint High Clarity Ultra-thin Front Rear Phone Full Coverage Hydrogel Protective Film For Vivo X50/X50 Pro/X50 Pro+/X60/X60 Pro/X60 Pro+,"₦ 12,578",,No rating
Mobile Phone Holder Multifunctional Wall-mounted Phone Remote Control Storage Box Organizer For Living Room-Blue,"₦ 12,578",,No rating
Waterproof Floating Hand Float Grip Anti-Slip Sport Floaty,"₦ 32,400",,No rating
Shock-proof Phone Case Easy Use TPU All-inclusive Lifted Edge Protective Shell Cover For IPhone 12/12 Pro/12 Mini/12 Pro Max/11/11 Pro/11 Pro Max/X/XS/XR/XR/7/8/7P/8P-Pink,"₦ 12,578",,No rating
LCD Display Touch Screen Digitizer For Samsung Galaxy-Pink,"₦ 67,000",,No rating
Magnetic Bracket Mini Aluminum Alloy Phone Wireless Charger Desk Lazy Stand With Reusable Sticky Base For IPhone 12 Series-Silver,"₦ 15,981",,No rating
Backpack Pendant Toy Skin-friendly Non-fading Adorable Polygon Geometric Section Cartoon Animal Key Chain Charm For Back Shell,"₦ 12,578",,No rating
Phone Back Cover Shining Anti-fingerprint PC Comfortable Grip Phone Protective Case For IPhone 13 Pro Max-Blue,"₦ 16,781",,No rating
Strong Contruction PC 3-layers Close Fit Phone Case Shockproof Phone Protector For IPhone 13 Mini/13/13 Pro/13Pro Max-Pink,"₦ 12,578",,No rating
File Bag Multi-layer Large Capacity Canvas A4 File-Pink,"₦ 12,578",,No rating
Phone Case Anti-fingerprint Smooth Surface TPU Phone Back Case With Card Holder For IPhone 13/13 Mini/13 Pro/13 Pro Max,"₦ 12,578",,No rating
Key Chain Decorative 12 Constellation Exquisite Universal,"₦ 25,650",,No rating
Camera Protector Super Thin Anti-spy 2 Colors Camera-Black,"₦ 12,578",,No rating
Phone Case Bright-colored Anti-scratch Silicone Lovely Cartoon Pattern Protector Case For IPhone 12/12 Pro/XR/11/X/XS/11 Pro.,"₦ 12,578",,No rating
2Pcs G3 Game Controller Portable Frequency Conversion 30 Shots/S Free Fire Shooting Key Aim Button Trigger Gamepad For IPhone,"₦ 22,000",,No rating
Car Mobile Phone Holder Universal Parking Number Plate Portable Windshield Cellphone Bracket For Center Console-Silver,"₦ 12,578",,No rating
Storage Shelf Multifunctional Strong Bearing Capacity Punch-free Wall-mounted Floating Steady Phone Charging Mount For Bedroom-White,"₦ 12,578",,No rating
Gaming Laptop Cooler Adjustable 2 USB Port 6 Fans-Red,"₦ 72,000",,No rating
Phone Case Cover Anti-fall Easy Installation Lightweight Liquid TPU Silicone Phone Protective Cover For IPhone 11/11Pro/11 Pro Max/12 Mini/12/12 Pro/12 Pro Max/13 Mini/13/13 Pro/13 Pro Max-Pink,"₦ 12,578",,No rating
Phone Stand Stretchable Dual Monitor Display Plastic Portable Creative Laptop Extension Bracket For Live Streaming-Light Green,"₦ 12,578",,No rating
Phone Bracket Foldable Fine Workmanship Aluminum Alloy Double Sides Lazy Desktop Mobile Phone Tablet Holder For Watching Videos-Black,"₦ 15,582",,No rating
Unique Mobile Phone U-Shaped Bracket Push-Pull-Multicolor,"₦ 12,578",,No rating
Phone Camera Tempered Film Anti-scratch High Strength Transparent Mobile Phone Rear Lens Ultra-thin Protective Cover For IPhone 13 Mini/13/13 Pro/13 Pro Max,"₦ 12,578",,No rating
10Pcs Mini Type-C Male To Micro USB Female Adapter-White,"₦ 25,650",,No rating
