Name,Discount_price,Old_price,Rating_stars
Metal Hand Grip Handheld Vlog Handle Stabilizer With 1 4,"₦ 35,100",,No rating
Shock-absorbing Phone Protector Card Holder Design TPU Anti Fade All-inclusive Antioxidant Protective Case For IPhone 12/12 Pro/12 Mini/12 Pro Max/11/11 Pro/11 Pro Max-Transparent,"₦ 12,578",,No rating
Phone Strap Anti-lost Adjustable Non-fading Long And Short Mobile Phone Hand Strap For Access Card-Black,"₦ 12,578",,No rating
Backpack Pendant Toy Skin-friendly Non-fading Adorable Polygon Geometric Section Cartoon Animal Key Chain Charm For Back Shell,"₦ 12,578",,No rating
Key Ring Non-fading Decorative Electroplated A-Z 26 Letter Metal Key Chain Charm For Promotional Gifts,"₦ 12,578",,No rating
A08 Car Travel Table Board Multifunctional Height Adjustable Universal Headrest Mount Seat Back Tray For Computer-Black,"₦ 92,000",,No rating
Phone Holder Adjustable Shock-resistant Foldable Smartphone Tablet Desk Stand For Video Calling-Pink,"₦ 12,578",,No rating
Key Ring Non-fading Decorative Electroplated A-Z 26 Letter Metal Key Chain Charm For Promotional Gifts,"₦ 12,578",,No rating
Audio Converter Multifunctional Quick Transmission Hot Swap 2 In 1 Type-C Phone Plug Play Audio Adapter Cable For Charging-Rose Gold,"₦ 12,578",,No rating
Waterproof Touching Underwater Pouch With Hanging Rope Swimming Surfing Universal Mobile Phone Case Bag For Diving-Gray Blue,"₦ 12,578",,No rating
Phone Back Cover Shining Anti-fingerprint PC Comfortable Grip Phone Protective Case For IPhone 13 Pro Max-Silver Gray,"₦ 16,781",,No rating
Selfie Tripod Adjustable Remote Control Professional Mini Tripod Extendable Monopod For YouTuber,"₦ 20,980",,No rating
Astronaut Figures Exquisite Workmanship Adorable Posture Attractive Miniature Spaceman Mobile Phone Holder For Desktop-Silver,"₦ 14,381",,No rating
LCD Touch Screen Capacitive Anti-scratch AMOLED LCD-Blue,"₦ 90,000",,No rating
Phone Back Shell Anti-fall Non-yellowing Transparent Soft TPU Phone Protective Cover With Four Air Bags For IPhone 13 Mini/13/13 Pro/13 Pro Max-Grey,"₦ 12,578",,No rating
Hydrogel Protective Cover Anti-fingerprint High Clarity Full Coverage Front Rear Phone Ultra-thin Hydrogel Protective Film For OPPO Reno 6/Reno 6 Pro/Reno 6 Pro+/Reno 5/Reno 5 Pro/Reno 5 Pro+/Reno 4/Reno 4 Pro/Reno 3/Reno 3 Pro,"₦ 12,578",,No rating
Game Gamepad Semiconductor Refrigeration Quick Cooling Universal Phone Cooling Fan Game Grip Handle For Android,"₦ 15,582",,No rating
LCD Display Sensitive Anti-scratch AMOLED LCD Touch Screen-,"₦ 70,000",,No rating
Replacement LCD Touch Screen Digitizer For Samsung-Black,"₦ 113,000",,No rating
Phone Protective Case Soft TPU Scratch-resistant Animal Butterfly Flower Mobile Phone Back Cover For IPhone XR,"₦ 12,578",,No rating
1 Set Wireless Converter Non-delayed Quick Response Driver-free Bluetooth5.0 Keyboard Mouse Sensitive USB Adapter For IOS,"₦ 26,000",,No rating
Phone Back Shell Shock-proof Anti-impact Waterproof Crocodile Print Faux Leather Phone Protective Cover For Samsung Galaxy Z Flip3 5G-White,"₦ 12,578",,No rating
Phone Case High Toughness Anti-fingerprint TPU Shock-absorbing Full Body Coverage Phone Cover For IPhone 12/12 Mini/12 Pro/12 Pro Max-Clear,"₦ 12,578",,No rating
Smartwatch Business Bluetooth Waterproof Sport Watch With Free Necklace,"₦ 15,504",,No rating
Computer Monitor Stand Riser With Storage Drawer PhoneWhite,"₦ 34,992",,No rating
10/100Mbps External USB 2.0 To RJ45 Network Card Lan-,"₦ 12,578",,No rating
H10 4-Finger Dual Cooling Fan Wired Game Controller,"₦ 34,884",,No rating
Key Chain Decorative Double Side Glass Ball Solar System Planet Nebula Keychain Pendant Birthday Gift For Mobile Phone,"₦ 12,578",,No rating
2Pcs Game Gamepad Zinc Alloy Mechanical Key Multifunctional Auxiliary Gaming Controller E-sports External Device For Android-Black,"₦ 13,000",,No rating
Backpack Pendant Toy Skin-friendly Non-fading Adorable Polygon Geometric Section Cartoon Animal Key Chain Charm For Back Shell,"₦ 13,000",,No rating
Phone Camera Tempered Film Anti-scratch High Transmittance Ultra-thin Cell Phone Rear Aluminum Alloy Lens Film Cover For IPhone 13 Series-Dazzling,"₦ 13,000",,No rating
Phone Camera Tempered Film Anti-scratch High Transmittance Ultra-thin Cell Phone Rear Aluminum Alloy Lens Film Cover For IPhone 13 Series-Dazzling,"₦ 13,000",,No rating
Metal Plate Ultra Thin Supporting Wireless Charging Universal Car Mount Magnetic Holder Iron Sheet For Mobile Phone-Black,"₦ 13,000",,No rating
Shock-proof Phone Case Easy Use TPU All-inclusive Lifted Edge Protective Shell Cover For IPhone 12/12 Pro/12 Mini/12 Pro Max/11/11 Pro/11 Pro Max/X/XS/XR/XR/7/8/7P/8P-Green,"₦ 13,000",,No rating
Phone Protective Case Magnetic Anti-Scratch Plastic Phone Protective Covers With Metal Ring For IPhone 13/13 Mini/13 Pro/13 Pro Max-Green,"₦ 12,578",,No rating
2Pcs Game Gamepad Zinc Alloy Mechanical Key Multifunctional Auxiliary Gaming Controller E-sports External Device For Android-Black,"₦ 13,000",,No rating
Phone Camera Tempered Film Anti-scratch High Transmittance Ultra-thin Cell Phone Rear Aluminum Alloy Lens Film Cover For IPhone 13 Series-Dazzling,"₦ 13,000",,No rating
Key Chain Pendant Non-fading Anti-fall Decorative Adorable Spaceman Phone Pendant Toy For Earphone Sleeve-Pink,"₦ 12,578",,No rating
Mobile Phone Holder Hook Design Wall Mounted Punch-free TV Remote Control Storage Box Organizer For Household-Light Green,"₦ 13,000",,No rating
Mobile Phone Holder Universal Foldable Portable Desktop Tablet Cell Phone Stand For Watching TV-Silver White,"₦ 13,000",,No rating
Mobile Phone Holder Hook Design Wall Mounted Punch-free TV Remote Control Storage Box Organizer For Household-Light Green,"₦ 12,578",,No rating
5Pcs Card Pin Burr-free Not Easy To Deform Compact Size SIM Card Tray Ejector Needle For Cellphone-Sliver White,"₦ 13,000",,No rating
Phone Holder Strong Bearing Capacity Multifunctional Electroplated Desk Smart Phone Tablet Lazy Bracket For Watching TV-Golden,"₦ 12,578",,No rating
Wireless Keyboard Mouse IR Remote Controller USB Receiver-,"₦ 14,381",,No rating
Cat 7 Ethernet Cable 32AWG Oxygen-free Copper 10Gbps High,"₦ 4,060",,No rating
Replacement LCD Display Touch Screen Digitizer Without-Black,"₦ 91,000",,No rating
Data Cable Quick Charging Multifunctional Plug Play Type-C Mini OTG Data Cable For Smart Phone-Black,"₦ 13,780",,No rating
Mobile Phone Holder Hook Design Wall Mounted Punch-free TV Remote Control Storage Box Organizer For Household-Dark Green,"₦ 12,578",,No rating
U-shaped Angled USB 3.1 Type C Male To Micro 5P Female USB-C Converter Adapter For Android Phone-Black,"₦ 12,578",,No rating
P13 Phone Bracket Adjustable Ergonomic Design ABS Lazy Table Metal Phone Tablet Holder For Live Broadcast-White,"₦ 19,981",,No rating
Ajazz AX365 Head-Mounted Game Headset Esports Full-Cover,"₦ 102,000",,No rating
Beaded Phone Lanyard Wrist Strap Pearl Handmade Rainbow Beads Keychain For Women Girls,"₦ 6,225",,No rating
Phone Stand Multifunctional 360 Degree Rotation Lightweight Universal Neckband Flexible Phone Lazy Bracket For Watching TV-Pink,"₦ 14,000",,No rating
Replacement AMOLED Touch Screen Digitizer For Samsung-Black,"₦ 75,000",,No rating
M163 Sports Wireless Bluethooth Stereo Headset,"₦ 23,000",,No rating
Phone Back Shell Anti-fall Non-yellowing Soft Liquid Silicone Phone Protective Cover For IPhone 7/8/SE/7 Plus/8Plus/X/XS/XR/XS Max/11/11Pro/11 Pro Max/12 Mini/12/12 Pro/12 Pro Max/13 Mini/13/13 Pro/13 Pro Max-Purple,"₦ 12,578",,No rating
Phone Camera Tempered Film Anti-scratch High Transmittance Ultra-thin Cell Phone Rear Aluminum Alloy Lens Film Cover For IPhone 13 Pro Series-Dazzling,"₦ 13,000",,No rating
Phone Camera Tempered Film Anti-scratch High Transmittance Ultra-thin Cell Phone Rear Aluminum Alloy Lens Film Cover For IPhone 13 Pro Series-Dazzling,"₦ 12,578",,No rating
AMOLED LCD Display Touch Screen Digitizer Replacement-Black,"₦ 70,000",,No rating
1 Pair X7 Game Trigger Ergonomic Design Convenient Assistant Portable Mobile Phone Game Controller For Android-Transparent White,"₦ 12,578",,No rating
LCD Touch Screen Digitizer For Samsung Galaxy J7 Prime-White,"₦ 53,000",,No rating
Mobile Phone Holder Mini Portable Universal Desktop Stand Cell Phone Lazy Bracket For Watching TV-Red,"₦ 12,578",,No rating
Mobile Phone Holder Hook Design Wall Mounted Punch-free TV Remote Control Storage Box Organizer For Household-Yellow,"₦ 12,578",,No rating
Key Chain Decorative 12 Constellation Exquisite Universal,"₦ 25,650",,No rating
Phone Camera Tempered Film Anti-scratch High Transmittance Ultra-thin Cell Phone Rear Aluminum Alloy Lens Film Cover For IPhone 13 Pro Series-Silver,"₦ 13,000",,No rating
Mobile Phone Holder Mini Portable Universal Desktop Stand Cell Phone Lazy Bracket For Watching TV-Pink,"₦ 13,000",,No rating
T612 Phone Stand Foldable Anti-slip Aluminum Alloy Portable Multifunctional Desktop Phone Tablet Bracket For Home-Silver,"₦ 18,782",,No rating
Audio Converter Multifunctional Quick Transmission Hot Swap 2 In 1 Type-C Phone Plug Play Audio Adapter Cable For Charging-Silver,"₦ 25,650",,No rating
Big Screen Watches Oem Smartwatch New 2021 Ip67 Ip68 Reloj,"₦ 81,000",,No rating
Phone Case Bright-colored Anti-scratch Silicone Lovely Cartoon Pattern Protector Case For IPhone 12/12 Pro/XR/11/X/XS/11 Pro.,"₦ 12,578",,No rating
Phone Back Shell Anti-fall Non-yellowing With Dust-proof Plug Transparent Soft Four Air Bags Phone Protective Cover For IPhone 13 Mini/13/13 Pro/13 Pro Max-Transparent,"₦ 12,578",,No rating
LCD Digital Display Touch Screen Digitizer Replacement-Black,"₦ 130,000",,No rating
Phone Stand Multifunctional 360 Degree Rotation Lightweight Universal Neckband Flexible Phone Lazy Bracket For Watching TV-Pink,"₦ 14,000",,No rating
1 Pair Game Joystick Sensitive High Strength Lightweight Bidirectional Auxiliary Phone Gaming Controller Button For IPhone-Black,"₦ 12,578",,No rating
Phone Camera Tempered Film High Transmittance Explosion-proof Ultra-thin Smart Phone Rear Single Lens Self-adhesive Film Cover For IPhone 13/13 Mini/13 Pro/13 Pro Max-Silver,"₦ 12,578",,No rating
LCD Touch Screen Professional High Sensitivity AMOLED LCD Display Digitizer Replace Assembly For Samsung Galaxy A01 Core A013 A013F,"₦ 64,000",,No rating
Screen Enlarger High Clearly Widely Compatible Acrylic 10/12 Inch Simple Operation Video Amplifier Holder For Watching TV-White,"₦ 14,978",,No rating
M10/M11 Trigger Gamepad Long Service Life Sensitive Easy To Hold 6 Finger Trigger Phone Controller Gamepad,"₦ 17,000",,No rating
Phone Lens Protective Film Anti-scratch Good Hardness Ultra-thin Smart Phone Rear Camera Dust-proof Protector For IPhone 13 Mini/13-Pink,"₦ 12,578",,No rating
M10/M11 Trigger Gamepad Long Service Life Sensitive Easy To Hold 6 Finger Trigger Phone Controller Gamepad,"₦ 17,000",,No rating
Q18 Smart Watch Strong Bluetooth SmartWatch,"₦ 30,905",,No rating
Magnetic Iron Sheet Universal Strong Suction Mini Car Phone Holder Magnetic Iron Sheet Sticker For Mobile Phone,"₦ 12,578",,No rating
Phone Holder Strong Bearing Capacity Multifunctional Electroplated Desk Smart Phone Tablet Lazy Bracket For Watching TV-Golden,"₦ 13,000",,No rating
Phone Camera Tempered Film Anti-scratch High Transmittance Ultra-thin Cell Phone Rear Aluminum Alloy Lens Film Cover For IPhone 13 Pro Series-Silver,"₦ 13,000",,No rating
Phone Camera Tempered Film Anti-scratch High Transmittance Ultra-thin Cell Phone Rear Aluminum Alloy Lens Film Cover For IPhone 13 Pro Series-Dazzling,"₦ 13,000",,No rating
Mobile Phone Holder Mini Portable Universal Desktop Stand Cell Phone Lazy Bracket For Watching TV-Pink,"₦ 13,000",,No rating
Phone Case Anti-fingerprint Smooth Surface TPU Phone Back Case With Card Holder For IPhone 13/13 Mini/13 Pro/13 Pro Max,"₦ 12,578",,No rating
Mobile Phone Holder Universal Adjustable Firstperson View Car Rearview Mirror Phone Buckle Clip For KitchenBlack,"₦ 16,685",,No rating
Mobile Phone Cover Anti-scratch Soft TPU Water Drop Leaf Geometric Pattern Back Phone Bumper Shell For Samsung Galaxy A11,"₦ 12,578",,No rating
Phone Stand Multifunctional Universal Foldable Desk Smart Phone Mini Lazy Bracket For Watching TV-Rose Gold,"₦ 12,578",,No rating
Shock-absorbing Phone Protector Card Holder Design TPU Anti Fade All-inclusive Antioxidant Protective Case For IPhone 12/12 Pro/12 Mini/12 Pro Max/11/11 Pro/11 Pro Max-Transparent,"₦ 12,578",,No rating
2Pcs Game Controller High Sensitivity 30 Shots/S Fast Free Shooting Key Aim Button Trigger Gamepad For Android Mobile Phone-Multicolor,"₦ 18,381",,No rating
Laptop Screen Support Multi-purpose Strong Suction Flexible Mobile Phone Computer Collaborative Magnetic Holder For Office-Grey,"₦ 12,578",,No rating
Y30 Cheap Stereo TWS Wireless 5.0 Bluetooth In-ear Earbuds,"₦ 32,200",,No rating
Multifunctional USB3.0 Video Capture Card With Microphone-,"₦ 68,000",,No rating
Shockproof Anti-wear Phone Case Exquisite Smooth Edge Silicone Phone Protector For IPhone13 Mini/13/13 Pro/13 Pro Max-Antique White,"₦ 12,578",,No rating
Shockproof Anti-wear Phone Case Exquisite Smooth Edge Silicone Phone Protector For IPhone13 Mini/13/13 Pro/13 Pro Max-Antique White,"₦ 12,578",,No rating
Magnetic Bracket Multifunctional Dual Screen Aluminum Alloy Laptop Side Mount Cell Phone Holder For Desktop-Silver,"₦ 13,581",,No rating
Y30 Cheap Stereo TWS Wireless 5.0 Bluetooth In-ear Earbuds,"₦ 12,591",,No rating
Stylus Pen Cover Anti-fall Split Contrast Color Full-Orange,"₦ 12,578",,No rating
Mini PCI-E To PCI-E X16 Riser External Graphics Card +-Blue,"₦ 15,582",,No rating
Phone Camera Tempered Film Anti-scratch High Transmittance Ultra-thin Cell Phone Rear Aluminum Alloy Lens Film Cover For IPhone 13 Pro Series-Dazzling,"₦ 13,000",,No rating
Phone Stand Multi-purpose Stretchable Foldable Universal Wireless Charger Stand For Watching TV-White,"₦ 12,578",,No rating
Car Phone Holder Multi-function Multi-angle Adjustment Car Dashboard Smartphone Clip Mount Stand With Number Plate For Sun Visor,"₦ 14,381",,No rating
Phone Camera Tempered Film Anti-scratch High Transmittance Ultra-thin Cell Phone Rear Aluminum Alloy Lens Film Cover For IPhone 13 Series-Blue,"₦ 12,578",,No rating
Phone Neck Chain Non-fading All-match Adjustable Handmade Braided Phone Strap Pendant For Earphone Sleeve-Deep  Purple,"₦ 12,578",,No rating
Portable Adjustable Handy LED Light USB Lamp For Laptop-,"₦ 12,578",,No rating
Phone Stand Rebound Anti-skid 2 In 1 Watch Charger Phone Bracket For IPhone Smartwatch-Grey,"₦ 12,578",,No rating
Phone Protective Case Soft TPU Scratch-resistant Animal Butterfly Flower Mobile Phone Back Cover For IPhone XR,"₦ 12,578",,No rating
Phone Holder Self-locking Waterproof Adjustable Bicycle Cell Phone Navigation Support For Motor Cycle-Red,"₦ 12,980",,No rating
Shock-absorbing Phone Protector Card Holder Design TPU Anti Fade All-inclusive Antioxidant Protective Case For IPhone 12/12 Pro/12 Mini/12 Pro Max/11/11 Pro/11 Pro Max-Transparent,"₦ 12,578",,No rating
Phone Camera Tempered Film High Transmittance Explosion-proof Ultra-thin Smart Phone Rear Single Lens Self-adhesive Film Cover For IPhone 13/13 Mini/13 Pro/13 Pro Max-Golden,"₦ 12,578",,No rating
2Pcs Game Gamepad Zinc Alloy Mechanical Key Multifunctional Auxiliary Gaming Controller E-sports External Device For Android-Black,"₦ 12,578",,No rating
Universal Detachable Braided Phone Case Lanyard-Light Blue,"₦ 25,650",,No rating
SP21 Phone Stand Portable Double Screen Interactive Aluminum Alloy Adjustable Laptop Extension Bracket For Live Streaming-Black,"₦ 12,578",,No rating
Car Phone Holder Multi-function Multi-angle Adjustment Car Dashboard Smartphone Clip Mount Stand With Number Plate For Sun Visor,"₦ 14,381",,No rating
Phone Camera Tempered Film Anti-scratch High Transmittance Ultra-thin Cell Phone Rear Aluminum Alloy Lens Film Cover For IPhone 13 Series-Blue,"₦ 12,578",,No rating
Phone Neck Chain Non-fading All-match Adjustable Handmade Braided Phone Strap Pendant For Earphone Sleeve-Deep  Purple,"₦ 12,578",,No rating
Portable Adjustable Handy LED Light USB Lamp For Laptop-,"₦ 12,578",,No rating
Phone Stand Rebound Anti-skid 2 In 1 Watch Charger Phone Bracket For IPhone Smartwatch-Grey,"₦ 12,578",,No rating
Phone Protective Case Soft TPU Scratch-resistant Animal Butterfly Flower Mobile Phone Back Cover For IPhone XR,"₦ 12,578",,No rating
Phone Holder Self-locking Waterproof Adjustable Bicycle Cell Phone Navigation Support For Motor Cycle-Red,"₦ 12,980",,No rating
Shock-absorbing Phone Protector Card Holder Design TPU Anti Fade All-inclusive Antioxidant Protective Case For IPhone 12/12 Pro/12 Mini/12 Pro Max/11/11 Pro/11 Pro Max-Transparent,"₦ 12,578",,No rating
Phone Camera Tempered Film High Transmittance Explosion-proof Ultra-thin Smart Phone Rear Single Lens Self-adhesive Film Cover For IPhone 13/13 Mini/13 Pro/13 Pro Max-Golden,"₦ 12,578",,No rating
2Pcs Game Gamepad Zinc Alloy Mechanical Key Multifunctional Auxiliary Gaming Controller E-sports External Device For Android-Black,"₦ 12,578",,No rating
Universal Detachable Braided Phone Case Lanyard-Light Blue,"₦ 25,650",,No rating
SP21 Phone Stand Portable Double Screen Interactive Aluminum Alloy Adjustable Laptop Extension Bracket For Live Streaming-Black,"₦ 12,578",,No rating
Phone Neck Strap Universal Multi-purpose Scentless Phone Back Shell Anti-lost Lanyard For Employee ID Card-Pink,"₦ 12,578",,No rating
Bag Pendant Decorative Non-fading Electroplated Simulation 3D Scooter Key Ring Buckle For Advertising Gift-Golden,"₦ 12,578",,No rating
Phone Screen Magnifier Foldable Highly Clear Lens Portable 12 Inch Curved Phone Screen Amplifier Holder For Watching Video-Black,"₦ 14,978",,No rating
Phone Fish Eye Lens HD-compatible Professional 3 In 1 10X Macro Wide Angle 4K Phone Camera Lens For Taking Photos-Red,"₦ 12,578",,No rating
Phone Holder Strong Bearing Capacity Stretchable Desk Smart Phone Lazy Bracket With Mirror For Watching TV-White,"₦ 12,578",,No rating
Phone Back Cover Multifunctional Anti-fall Ultra-thin Fashionable Metal Square Buckle Support Phone Case For IPhone 11 Pro Max/11 Pro/11/XS Max/X/XS/12/12 Pro/12 Pro Max-Orange,"₦ 12,578",,No rating
Audio Converter Multifunctional Quick Transmission Hot Swap 2 In 1 Type-C Phone Plug Play Audio Adapter Cable For Charging-Black,"₦ 12,578",,No rating
30cm 2 Cores 20 Copper Wires Micro USB 2.0 Charger Cable,"₦ 10,956",,No rating
Y30 Bluetooth Wireless Earphone Earbuds For Samsung IPhone Apple Xiaomi Huawei Vivo IOSAndroidBlack,"₦ 10,716",,No rating
Mobile Phone Case Ultrathin Shockproof Transparent Clear Phone Back Cover Shell For Samsung GalaxyZFlip35GTransparent,"₦ 27,254",,No rating
Shockproof Phone Case Easy Use TPU Allinclusive Lifted Edge Protective Shell Cover For IPhone 1212 Pro12 Mini12 Pro Max1111 Pro11 Pro MaxXXSXRXR787P8PGreen,"₦ 38,157",,No rating
Silicone Battery Case Soft Silicone Protective Cover for Apple Vision Black,"₦ 6,012",,No rating
Phone Holder Adjustable Shock-resistant Foldable Smartphone Tablet Desk Stand For Video Calling-Black,"₦ 12,578",,No rating
Phone Back Shell Anti-fall Non-yellowing Soft Liquid Silicone Phone Protective Cover For IPhone 7/8/SE/7 Plus/8Plus/X/XS/XR/XS Max/11/11Pro/11 Pro Max/12 Mini/12/12 Pro/12 Pro Max/13 Mini/13/13 Pro/13 Pro Max-Orange,"₦ 12,578",,No rating
Car Phone Holder Magnetic 360 Degree Rotation-Silver,"₦ 12,578",,No rating
Phone Case Cover Anti-fall Easy Installation Lightweight Liquid TPU Silicone Phone Protective Cover For IPhone 11/11Pro/11 Pro Max/12 Mini/12/12 Pro/12 Pro Max/13 Mini/13/13 Pro/13 Pro Max-Brown,"₦ 12,578",,No rating
Multi-use PC Practical Shock-proof Phone Case Full Cover Phone Protector For IPhone 13 Mini/13/13 Pro/13 Pro Max-White,"₦ 12,578",,No rating
LCD Touch Screen Digitizer For Samsung Galaxy J7 Prime-White,"₦ 46,000",,No rating
Phone Holder Foldable Adjustable Portable Aluminium Alloy Invisible Phone Stand For Living Streaming-Silver,"₦ 12,578",,No rating
Storage Shelf Multi-purpose Strong Adhesiveness Punch-free Wall-mounted Floating Phone Tablet Steady Mount For Home-Date Red,"₦ 12,578",,No rating
2Pcs G3 Game Controller Portable Frequency Conversion 30 Shots/S Free Fire Shooting Key Aim Button Trigger Gamepad For IPhone,"₦ 15,981",,No rating
6 Inch Desktop LED Ring Light 3200K-5500K Dimmable Mini,"₦ 28,656",,No rating
AMOLED LCD Screen Digitizer Replacement For Samsung-Black,"₦ 76,000",,No rating
Phone Case Multifunctional Shock-proof Soft 3D Card Bag Phone Back Shell With Shoulder Strap For IPhone 13/13 Pro/13 Pro Max-Khaki,"₦ 14,381",,No rating
Key Ring Non-fading Decorative Electroplated A-Z 26 Letter Metal Key Chain Charm For Promotional Gifts,"₦ 12,578",,No rating
Phone Neck Chain Non-fading All-match Adjustable Handmade Braided Phone Strap Pendant For Earphone Sleeve-Amber Gold,"₦ 12,578",,No rating
Phone Case Shock-proof All-inclusive Flexible Phone PC Fold Bumper Cover With Finger Ring Holder For Samsung Flip 3-Green,"₦ 17,780",,No rating
Replacement LCD Touch Screen Digitizer For Sam-sung-White,"₦ 127,000",,No rating
Phone Holder Strong Bearing Capacity Stretchable Desk Smart Phone Lazy Bracket With Mirror For Watching TV-Green,"₦ 12,578",,No rating
Mobile Phone Holder Universal Foldable Long Strip Desktop Magnetic Sliding Phone Mount Bracket For Laptop-Red Black,"₦ 12,578",,No rating
Phone Stand Multifunctional Universal Foldable Desk Smart Phone Mini Lazy Bracket For Watching TV-Black Gray,"₦ 12,578",,No rating
Metal Plate Ultra Thin Supporting Wireless Charging Universal Car Mount Magnetic Holder Iron Sheet For Mobile Phone-Red,"₦ 12,578",,No rating
Mobile Phone Holder Hook Design Wall Mounted Punch-free TV Remote Control Storage Box Organizer For Household-Light Green,"₦ 13,000",,No rating
Phone Stand Stretchable Dual Monitor Display Plastic Portable Creative Laptop Extension Bracket For Live Streaming-White,"₦ 12,578",,No rating
Fill Light Universal Anti-skid Adjustable Cell Phone Cartoon Mini Clip Fill Lamp For Video Recording-Blue,"₦ 12,578",,No rating
Phone Bracket Foldable Fine Workmanship Aluminum Alloy Double Sides Lazy Desktop Mobile Phone Tablet Holder For Watching Videos-Blue,"₦ 15,181",,No rating
L-01 Phone Radiator Portable Fast Heat Dissipation Semi-comductor Gaming Phone Cooler For Video Playing-Black,"₦ 22,000",,No rating
Key Ring Vivid Decorative Cartoon Creative Drumstick Pig Feet Simulation Food Backpack Pendant For Car Key,"₦ 12,578",,No rating
Back Film Ultra-thin Gradient Transparent Phone Back Screen Full Cover For IPhone X/XR/XS/11/11 Pro/12 Mini/12/12 Pro,"₦ 12,578",,No rating
Phone Case Cover Anti-fall Easy Installation Lightweight Liquid TPU Silicone Phone Protective Cover For IPhone 11/11Pro/11 Pro Max/12 Mini/12/12 Pro/12 Pro Max/13 Mini/13/13 Pro/13 Pro Max-Yellow,"₦ 12,578",,No rating
Phone Stand Multifunctional Adjustable Ultra-thin Smart Phone Tablet Desk Mini Lazy Bracket For Watching TV-Grey,"₦ 15,981",,No rating
Phone Back Case Shock-proof Anti-fall Soft Fu Character TPU Transparent Phone Case For IPhone 13 Mini/13/13 Pro/13 Pro Max/12/12 Pro/12 Pro Max/11/11 Pro/11 Pro Max,"₦ 12,578",,No rating
Phone Case Full Coverage Illustrated Girl Pattern Straight-sided Colorfast Smartphone Protective Shell For IPhone 13/13 Pro/13 Pro Max-Dark Orange,"₦ 12,578",,No rating
LCD Display Touch Screen Digitizer Assembly Parts For-Black,"₦ 67,000",,No rating
Stain Resistant Mouse Pad Strap Design Faux Leather-Sky Blue,"₦ 14,978",,No rating
Replacement AMOLED Touch Screen Digitizer For Samsung-Black,"₦ 75,000",,No rating
Audio Converter Multifunctional Quick Transmission Hot Swap 2 In 1 Type-C Phone Plug Play Audio Adapter Cable For Charging-Silver,"₦ 12,578",,No rating
Backpack Pendant Toy Skin-friendly Non-fading Adorable Polygon Geometric Section Cartoon Animal Key Chain Charm For Back Shell,"₦ 12,578",,No rating
Phone Screen Glass Lens Cover For Samsung Galaxy Note-,"₦ 50,000",,No rating
Car Mobile Phone Holder Universal Parking Number Plate Portable Windshield Cellphone Bracket For Center Console-Red,"₦ 12,578",,No rating
Nano Stickers Multifunctional Storage Stickers Stickers Nano,"₦ 10,000",,No rating
Computer Monitor Stand Riser With Storage Drawer Phone-White,"₦ 27,000",,No rating
2Pcs Laptop Stand Collapsible Heat Dissipation ABS-Black,"₦ 12,578",,No rating
AMOLED LCD Display Digitizer Without Frame Replacement-Black,"₦ 73,000",,No rating
Shockproof Anti-wear Phone Case Exquisite Smooth Edge Silicone Phone Protector For IPhone13 Mini/13/13 Pro/13 Pro Max-Matcha Green,"₦ 12,578",,No rating
Phone Converter High-speed Multifunctional Hot Swap-Grey,"₦ 25,650",,No rating
Phone Holder Multifunctional Strong Bearing Capacity Folding Table Cell Phone Tablet Supporting Stand For Study-Grey,"₦ 18,381",,No rating
Neck Hold Mount Lanyard Strap For Hero 10 9 8 7 6 5 4 OSMO,"₦ 56,700",,No rating
2Pcs Game Controller High Sensitivity 30 Shots/S Fast Free Shooting Key Aim Button Trigger Gamepad For Android Mobile Phone-Blue,"₦ 15,981",,No rating
Portable Adjustable Non-Slip Mobile Phone Laptop-Black,"₦ 19,000",,No rating
Waterproof Bag Universal Ultra-thin Cartoon IP68 Floating Air Phone Bag For Swimming-#2,"₦ 12,578",,No rating
Phone Stand Stretchable Dual Monitor Display Plastic Portable Creative Laptop Extension Bracket For Live Streaming-Dark Gray,"₦ 32,340",,No rating
Replacement LCD Touch Screen Digitizer For Sam-sung-Golden,"₦ 128,000",,No rating
Wireless BT Adapter Receiver Standard 3.5mm,"₦ 27,744",,No rating
AMOLED LCD Display Touch Panel Screen Digitizer Assembly-,"₦ 70,000",,No rating
Key Ring Non-fading Decorative Electroplated A-Z 26 Letter Metal Key Chain Charm For Promotional Gifts,"₦ 12,578",,No rating
